,Unnamed: 0,project_number,location_name,year_range,from,to,from_lat_long,to_lat_long,from_blockgroup,to_blockgroup
3145,3145,[170 -04] 39743,On N Washtenaw Ave From W Albion Ave To W Devon Ave,2019-2023,N Washtenaw Ave And W Albion Ave,N Washtenaw Ave And W Devon Ave,"[42.0012269, -87.6972906]","[41.997595, -87.697222]",170310206023,170310208023
3146,3146,[170 -04] 39743,On N Washtenaw Ave From W Birchwood Ave To W Fargo Ave,2019-2023,N Washtenaw Ave And W Birchwood Ave,N Washtenaw Ave And W Fargo Ave,"[42.017575, -87.697273]","[42.0166681, -87.6972938]",170310202004,170310202004
3147,3147,[170 -04] 39743,On N Washtenaw Ave From W Thorndale Ave To W Ardmore Ave,2019-2023,N Washtenaw Ave And W Thorndale Ave,N Washtenaw Ave And W Ardmore Ave,"[41.9885863, -87.6969119]","[41.9867639, -87.6968579]",170310208012,170310208013
3148,3148,[170 -04] 39743,On S Rockwell St From W 54th St To W 55th St,2019-2023,S Rockwell St And W 54th St,S Rockwell St And W 55th St,"[41.7956308, -87.6889636]","[41.793818, -87.688925]",170316305002,170316305002
3149,3149,[170 -04] 39743,On N Willard Ct From W Superior St To W Huron St,2019-2023,N Willard Ct And W Superior St,N Willard Ct And W Huron St,"[41.895313, -87.658462]","[41.8944022, -87.6584549]",170312434001,170312434001
3150,3150,[170 -04] 39743,On S Aberdeen St From W 77th St To W 79th St,2019-2023,S Aberdeen St And W 77th St,S Aberdeen St And W 79th St,"[41.754175, -87.651406]","[41.750539, -87.651324]",170317102003,170317108005
3151,3151,[170 -04] 39743,On N Meade Ave From N Avondale Ave To W Balmoral Ave,2019-2023,N Meade Ave And N Avondale Ave,N Meade Ave And W Balmoral Ave,"[41.980074, -87.780791]","[41.9792892, -87.7808984]",170311103001,170311103002
3152,3152,[170 -04] 39743,On N Mcvicker Ave From N Northwest Hwy To W Bryn Mawr Ave,2019-2023,N Mcvicker Ave And N Northwest Hwy,N Mcvicker Ave And W Bryn Mawr Ave,"[41.981244, -87.779332]","[41.982869, -87.779227]",170311102002,170311102002
3153,3153,[170 -04] 39743,On S Aberdeen St From W 85th St To W 87th St,2019-2023,S Aberdeen St And W 85th St,S Aberdeen St And W 87th St,"[41.7395927, -87.6509899]","[41.735912, -87.650925]",170317110003,170317114002
3154,3154,[170 -04] 39743,On N Marmora Ave From W Bryn Mawr Ave To W Catalpa Ave,2019-2023,N Marmora Ave And W Bryn Mawr Ave,N Marmora Ave And W Catalpa Ave,"[41.982873, -87.775622]","[41.981066, -87.775661]",170311102002,170311102002
3155,3155,[170 -04] 39743,On N May St From W Kinzie St To W Hubbard St,2019-2023,N May St And W Kinzie St,N May St And W Hubbard St,"[41.8889591, -87.6557182]","[41.890019, -87.655774]",170318330002,170312435001
3156,3156,[170 -04] 39743,On E 73rd St From S Cottage Grove Ave To S South Chicago Ave,2019-2023,E 73rd St And S Cottage Grove Ave,E 73rd St And S South Chicago Ave,"[41.762215, -87.605502]","[41.762275, -87.60052]",170316909002,170318418001
3157,3157,[170 -04] 39743,On E 73rd St From S Eberhart Ave To S Rhodes Ave,2019-2023,E 73rd St And S Eberhart Ave,E 73rd St And S Rhodes Ave,"[41.762088, -87.612768]","[41.762108, -87.611566]",170316909005,170316909003
3158,3158,[170 -04] 39743,On E 75th St From S Drexel Ave To S Ingleside Ave,2019-2023,E 75th St And S Drexel Ave,E 75th St And S Ingleside Ave,"[41.758594, -87.602948]","[41.758608, -87.601736]",170316915001,170316915001
3159,3159,[170 -04] 39743,On N Aberdeen St From W Kinzie St To W Hubbard St,2019-2023,N Aberdeen St And W Kinzie St,N Aberdeen St And W Hubbard St,"[41.888967, -87.654564]","[41.890026, -87.654597]",170318330001,170312435001
3160,3160,[170 -04] 39743,On N Albany Ave From W Carmen Ave To W Argyle St,2019-2023,N Albany Ave And W Carmen Ave,N Albany Ave And W Argyle St,"[41.9739684, -87.706205]","[41.972105, -87.706136]",170311401001,170311401002
3161,3161,[170 -04] 39743,On N Avers Ave From W Ohio St To W Ferdinand St,2019-2023,N Avers Ave And W Ohio St,N Avers Ave And W Ferdinand St,"[41.891737, -87.722317]","[41.889899, -87.722273]",170312315006,170312315005
3162,3162,[170 -04] 39743,On N Canfield Ave From W Bryn Mawr Ave To W Balmoral Ave,2019-2023,N Canfield Ave And W Bryn Mawr Ave,N Canfield Ave And W Balmoral Ave,"[41.981377, -87.823713]","[41.977748, -87.824181]",170311005004,170311005004
3163,3163,[170 -04] 39743,On N Clark St From W Randolph St To W Calhoun Pl,2019-2023,N Clark St And W Randolph St,N Clark St And W Calhoun Pl,"[41.884509, -87.630926]","[41.882588, -87.630899]",170318391001,170318391001
3164,3164,[170 -04] 39743,On N Elizabeth St From W Madison St To W Washington Blvd,2019-2023,N Elizabeth St And W Madison St,N Elizabeth St And W Washington Blvd,"[41.881648, -87.658767]","[41.882982, -87.658801]",170318330002,170318330002
3165,3165,[170 -04] 39743,On N Fairfield Ave From W Albion Ave To W Devon Ave,2019-2023,N Fairfield Ave And W Albion Ave,N Fairfield Ave And W Devon Ave,"[42.0012269, -87.6985183]","[41.997576, -87.698437]",170310206011,170310208023
3166,3166,[170 -04] 39743,On N Hamlin Ave From W Belmont Ave To N Milwaukee Ave,2019-2023,N Hamlin Ave And W Belmont Ave,N Hamlin Ave And N Milwaukee Ave,"[41.939177, -87.722312]","[41.937017, -87.720422]",170318311004,170312105011
3167,3167,[170 -04] 39743,On N California Ave From W Eisenhower Expy To W Harrison St,2019-2023,N California Ave And W Eisenhower Expy,N California Ave And W Harrison St,"[41.9340198348771, -87.6975997500535]","[42.0189947, -87.6996023500021]",170312109002,170310202003
3168,3168,[170 -04] 39743,On N Janssen Ave From W Grace St To W Addison St,2019-2023,N Janssen Ave And W Grace St,N Janssen Ave And W Addison St,"[41.950691, -87.66573]","[41.947081, -87.665211]",170310604001,170310604002
3169,3169,[170 -04] 39743,On N Keeler Ave From W Devon Ave To W Granville Ave,2019-2023,N Keeler Ave And W Devon Ave,N Keeler Ave And W Granville Ave,"[41.997149, -87.733782]","[41.9937036, -87.7337414]",170311203001,170311203001
3170,3170,[170 -04] 39743,On N Kenneth Ave From W Carmen Ave To W Ainslie St,2019-2023,N Kenneth Ave And W Carmen Ave,N Kenneth Ave And W Ainslie St,"[41.9736022, -87.7393416]","[41.969965, -87.73921]",170311404004,170311404004
3171,3171,[170 -04] 39743,On N Kildare Ave From W Devon Ave To W Granville Ave,2019-2023,N Kildare Ave And W Devon Ave,N Kildare Ave And W Granville Ave,"[41.997147, -87.736214]","[41.993705, -87.7361575]",170311203005,170311203001
3172,3172,[170 -04] 39743,On N Magnolia Ave From W Thorndale Ave To W Rosedale Ave,2019-2023,N Magnolia Ave And W Thorndale Ave,N Magnolia Ave And W Rosedale Ave,"[41.9899813, -87.661537]","[41.988993, -87.661545]",170310302002,170310305001
3173,3173,[170 -04] 39743,On N Kilpatrick Ave From N Sauganash Ave To N Hiawatha Ave,2019-2023,N Kilpatrick Ave And N Sauganash Ave,N Kilpatrick Ave And N Hiawatha Ave,"[41.9947528, -87.7428317]","[41.9916767, -87.7454214]",170311203006,170311203006
3174,3174,[170 -04] 39743,On N Knox Ave From N Hiawatha Ave To N Ionia Ave,2019-2023,N Knox Ave And N Hiawatha Ave,N Knox Ave And N Ionia Ave,"[41.9911904, -87.7443842]","[41.9927645, -87.7430654]",170311203004,170311203006
3175,3175,[170 -04] 39743,On N Kolmar Ave From W Rosemont Ave To N Sauganash Ave,2019-2023,N Kolmar Ave And W Rosemont Ave,N Kolmar Ave And N Sauganash Ave,"[41.9956383, -87.7422906]","[41.9947528, -87.7428317]",170311203005,170311203006
3176,3176,[170 -04] 39743,On N Lakewood Ave From W Rosemont Ave To W Granville Ave,2019-2023,N Lakewood Ave And W Rosemont Ave,N Lakewood Ave And W Granville Ave,"[41.9963881, -87.662971]","[41.9945112, -87.6629017]",170310302001,170310302002
3177,3177,[170 -04] 39743,On N Leavitt St From W North Ave To W Division St,2019-2023,N Leavitt St And W North Ave,N Leavitt St And W Division St,"[41.910408, -87.682346]","[41.903126, -87.682146]",170312405001,170312412001
3178,3178,[170 -04] 39743,On N Lowell Ave From W Devon Ave To W Granville Ave,2019-2023,N Lowell Ave And W Devon Ave,N Lowell Ave And W Granville Ave,"[41.997152, -87.737432]","[41.9937235, -87.7373922]",170311203005,170311203005
3179,3179,[170 -04] 39743,On N Harding Ave From W Ohio St To W Ferdinand St,2019-2023,N Harding Ave And W Ohio St,N Harding Ave And W Ferdinand St,"[41.891724, -87.72473]","[41.889879, -87.724662]",170312315006,170312315005
3180,3180,[170 -04] 39743,On N Ozark Ave From W Peterson Ave To W Rosedale Ave,2019-2023,N Ozark Ave And W Peterson Ave,N Ozark Ave And W Rosedale Ave,"[41.9887059, -87.8204496]","[41.9876235, -87.8204563]",170311004002,170311004002
3181,3181,[170 -04] 39743,On N Overhill Ave From W Higgins Ave To W Bryn Mawr Ave,2019-2023,N Overhill Ave And W Higgins Ave,N Overhill Ave And W Bryn Mawr Ave,"[41.983168, -87.819275]","[41.981501, -87.81929]",170311005004,170311005004
3182,3182,[170 -04] 39743,On N Ottawa Ave From W Higgins Ave To W Bryn Mawr Ave,2019-2023,N Ottawa Ave And W Higgins Ave,N Ottawa Ave And W Bryn Mawr Ave,"[41.98294, -87.818024]","[41.981541, -87.818067]",170311005004,170311005004
3183,3183,[170 -04] 39743,On N Orleans St From W Wisconsin St To W Menomonee St,2019-2023,N Orleans St And W Wisconsin St,N Orleans St And W Menomonee St,"[41.9165214, -87.6375414]","[41.9147684, -87.6374831]",170310715004,170310715004
3184,3184,[170 -04] 39743,On N Meade Ave From N Northwest Hwy To W Bryn Mawr Ave,2019-2023,N Meade Ave And N Northwest Hwy,N Meade Ave And W Bryn Mawr Ave,"[41.981899, -87.780514]","[41.982872, -87.78042]",170311102002,170311102002
3185,3185,[170 -04] 39743,On N Neva Ave From N Avondale Ave To W Hood Ave,2019-2023,N Neva Ave And N Avondale Ave,N Neva Ave And W Hood Ave,"[41.995088, -87.805535]","[41.9923278, -87.8056391]",170311002005,170311003004
3186,3186,[170 -04] 39743,On N Moody Ave From N Avondale Ave To W Foster Ave,2019-2023,N Moody Ave And N Avondale Ave,N Moody Ave And W Foster Ave,"[41.980866, -87.782198]","[41.975626, -87.782353]",170311103001,170311103003
3187,3187,[170 -04] 39743,On N Melvina Ave From W Foster Ave To W Balmoral Ave,2019-2023,N Melvina Ave And W Foster Ave,N Melvina Ave And W Balmoral Ave,"[41.975619, -87.783038]","[41.979288, -87.7835513]",170311103003,"[41.979288, -87.7835513]"
3188,3188,[170 -04] 39743,On N Peoria St From W Erie St To W Huron St,2019-2023,N Peoria St And W Erie St,N Peoria St And W Huron St,"[41.8933435, -87.6500686]","[41.8950597, -87.6501288]",170312435002,170312435002
3189,3189,[170 -04] 39743,On N Northcott Ave From N Neva Ave To N Nickerson Ave,2019-2023,N Northcott Ave And N Neva Ave,N Northcott Ave And N Nickerson Ave,"[41.9933538, -87.805641]","[41.9923479, -87.8038498]",170311003004,170311003004
3190,3190,[170 -04] 39743,On N Racine Ave From W Kinzie St To W Hubbard St,2019-2023,N Racine Ave And W Kinzie St,N Racine Ave And W Hubbard St,"[41.8889499, -87.6569745]","[41.890004, -87.657375]",170312435001,170312434002
3191,3191,[170 -04] 39743,On S Aberdeen St From W 73rd St To W 74th St,2019-2023,S Aberdeen St And W 73rd St,S Aberdeen St And W 74th St,"[41.761459, -87.65161]","[41.759641, -87.651561]",170316814002,170316814002
3192,3192,[170 -04] 39743,On N Sawyer Ave From W Huron St To W Chicago Ave,2019-2023,N Sawyer Ave And W Huron St,N Sawyer Ave And W Chicago Ave,"[41.893711, -87.70772]","[41.895555, -87.707804]",170318367001,170318366001
3193,3193,[170 -04] 39743,On N Seminary Ave From W Diversey School Ct To N Lincoln Ave,2019-2023,N Seminary Ave And W Diversey School Ct,N Seminary Ave And N Lincoln Ave,"[41.932172, -87.655818]","[41.930746, -87.656157]",170310704001,170310704001
3194,3194,[170 -04] 39743,On N Talman Ave From W Albion Ave To W Devon Ave,2019-2023,N Talman Ave And W Albion Ave,N Talman Ave And W Devon Ave,"[42.0012508, -87.6960675]","[41.99762, -87.696008]",170310206023,170310208023
3195,3195,[170 -04] 39743,On N Throop St From W Chicago Ave To W Huron St,2019-2023,N Throop St And W Chicago Ave,N Throop St And W Huron St,"[41.896214, -87.660435]","[41.8943723, -87.6603754]",170318423001,170312434001
3196,3196,[170 -04] 39743,On N Union Ave From W Grand Ave To W Hubbard St,2019-2023,N Union Ave And W Grand Ave,N Union Ave And W Hubbard St,"[41.8912077, -87.6458148]","[41.8901, -87.645794]",170318423002,170318423002
3197,3197,[170 -04] 39743,On N Wabash Ave From E Wacker Pl To E Madison St,2019-2023,N Wabash Ave And E Wacker Pl,N Wabash Ave And E Madison St,"[41.8867767, -87.6262953]","[41.8821205, -87.6262227]",170313201002,170313201001
3198,3198,[170 -04] 39743,On N Waller Ave From W Chicago Ave To W Ohio St,2019-2023,N Waller Ave And W Chicago Ave,N Waller Ave And W Ohio St,"[41.894832, -87.767935]","[41.8910696, -87.7678049]",170312513002,170312514002
3199,3199,[170 -04] 39743,On N Washtenaw Ave From W Belmont Ave To N Elston Ave,2019-2023,N Washtenaw Ave And W Belmont Ave,N Washtenaw Ave And N Elston Ave,"[42.01914485, -87.697255550009]","[41.937354, -87.695303]",170310202004,170312109001
3200,3200,[170 -04] 39743,On N Washtenaw Ave From W Fargo Ave To W Jarvis Ave,2019-2023,N Washtenaw Ave And W Fargo Ave,N Washtenaw Ave And W Jarvis Ave,"[42.0166681, -87.6972938]","[42.0157554, -87.6972992]",170310202004,170310202004
3201,3201,[170 -04] 39743,On N Western Ave From W Granville Ave To W Devon Ave,2019-2023,N Western Ave And W Granville Ave,N Western Ave And W Devon Ave,"[41.9940952, -87.6897356]","[41.99773, -87.689814]",170310209013,170310209011
3202,3202,[170 -04] 39743,On N Mcvicker Ave From W Foster Ave To W Balmoral Ave,2019-2023,N Mcvicker Ave And W Foster Ave,N Mcvicker Ave And W Balmoral Ave,"[41.975624, -87.779404]","[41.979241, -87.779539]",170311103003,170311103002
3203,3203,[170 -04] 39743,On N Sacramento Ave From W Sherwin Ave To W Touhy Ave,2019-2023,N Sacramento Ave And W Sherwin Ave,N Sacramento Ave And W Touhy Ave,"[42.0146955, -87.7044184]","[42.011983, -87.7044446]",170310202001,170310202001
3204,3204,[170 -04] 39743,On N Mayfield Ave From W West End Ave To W Fulton St,2019-2023,N Mayfield Ave And W West End Ave,N Mayfield Ave And W Fulton St,"[41.884156, -87.771862]","[41.885591, -87.771898]",170312520003,170312520004
3205,3205,[170 -04] 39743,On N Hermitage Ave From W Waveland Ave To W Addison St,2019-2023,N Hermitage Ave And W Waveland Ave,N Hermitage Ave And W Addison St,"[41.948771, -87.672489]","[41.9469533, -87.6725465]",170310603002,170310603002
3206,3206,[170 -04] 39743,On N Maplewood Ave From W Birchwood Ave To W Fargo Ave,2019-2023,N Maplewood Ave And W Birchwood Ave,N Maplewood Ave And W Fargo Ave,"[42.0176446, -87.6937372]","[42.0167478, -87.6937158]",170310202004,170310202004
3207,3207,[170 -04] 39743,On S Aberdeen St From W 83rd St To W 84th St,2019-2023,S Aberdeen St And W 83rd St,S Aberdeen St And W 84th St,"[41.743254, -87.651112]","[41.741418, -87.651053]",170317108006,170317110001
3208,3208,[170 -04] 39743,On E 72nd Pl From S Dorchester Ave To S Blackstone Ave,2019-2023,E 72nd Pl And S Dorchester Ave,E 72nd Pl And S Blackstone Ave,"[41.763301, -87.590912]","[41.7633108, -87.5884671]",170314304002,170314304002
3209,3209,[170 -04] 39743,On E 73rd St From S Dorchester Ave To S Stony Island Ave,2019-2023,E 73rd St And S Dorchester Ave,E 73rd St And S Stony Island Ave,"[41.762362, -87.590896]","[41.762394, -87.585829]",170314304003,170314309001
3210,3210,[170 -04] 39743,On E 73rd St From S Rhodes Ave To S Eberhart Ave,2019-2023,E 73rd St And S Rhodes Ave,E 73rd St And S Eberhart Ave,"[41.762108, -87.611566]","[41.762088, -87.612768]",170316909003,170316909005
3211,3211,[170 -04] 39743,On E Ontario St From N St Clair St To N Michigan Ave,2019-2023,E Ontario St And N St Clair St,E Ontario St And N Michigan Ave,"[41.8933579, -87.6227094]","[41.8933415, -87.6242939]",170310814032,170310815002
3212,3212,[170 -04] 39743,On N Ada St From W Chicago Ave To W Huron St,2019-2023,N Ada St And W Chicago Ave,N Ada St And W Huron St,"[41.896198, -87.661372]","[41.8943603, -87.6613624]",170318423001,170312434001
3213,3213,[170 -04] 39743,On N Artesian Ave From W Birchwood Ave To W Fargo Ave,2019-2023,N Artesian Ave And W Birchwood Ave,N Artesian Ave And W Fargo Ave,"[42.0176945, -87.6913285]","[42.0168076, -87.691393]",170310202004,170310202004
3214,3214,[170 -04] 39743,On N Avondale Ave From W Hurlbut St To W Somerset Ave,2019-2023,N Avondale Ave And W Hurlbut St,N Avondale Ave And W Somerset Ave,"[41.986648, -87.7907]","[41.984946, -87.787703]",170311003001,170311003001
3215,3215,[170 -04] 39743,On N California Ave From W Foster Ave To W Carmen Ave,2019-2023,N California Ave And W Foster Ave,N California Ave And W Carmen Ave,"[42.0096175000001, -87.6997705000191]","[41.974012, -87.698875]",170310203013,170310403003
3216,3216,[170 -04] 39743,On N Carpenter St From W Kinzie St To W Hubbard St,2019-2023,N Carpenter St And W Kinzie St,N Carpenter St And W Hubbard St,"[41.888976, -87.653389]","[41.890046, -87.653434]",170318330001,170312435001
3217,3217,[170 -04] 39743,On N Damen Ave From W Warren Blvd To W Monroe St,2019-2023,N Damen Ave And W Warren Blvd,N Damen Ave And W Monroe St,"[41.8822439, -87.6767199]","[41.88322830200195, -87.63240051269531]",170318378002,170318391001
3218,3218,[170 -04] 39743,On N Mason Ave From N Northwest Hwy To W Bryn Mawr Ave,2019-2023,N Mason Ave And N Northwest Hwy,N Mason Ave And W Bryn Mawr Ave,"[41.979904, -87.776939]","[41.982863, -87.776842]",170311102002,170311102002
3219,3219,[170 -04] 39743,On N Elston Ave From N Albany Ave To W Henderson St,2019-2023,N Elston Ave And N Albany Ave,N Elston Ave And W Henderson St,"[41.944207, -87.705267]","[41.941363, -87.701141]",170312101003,170312101001
3220,3220,[170 -04] 39743,On N Hamlin Ave From W Fullerton Ave To W Wrightwood Ave,2019-2023,N Hamlin Ave And W Fullerton Ave,N Hamlin Ave And W Wrightwood Ave,"[41.924602, -87.72189]","[41.928206, -87.721982]",170312207013,170312207021
3221,3221,[170 -04] 39743,On N Karlov Ave From W Devon Ave To W Granville Ave,2019-2023,N Karlov Ave And W Devon Ave,N Karlov Ave And W Granville Ave,"[41.997147, -87.731362]","[41.9936927, -87.7313049]",170311203001,170311203001
3222,3222,[170 -04] 39743,On N Kenmore Ave From W Winona St To W Argyle St,2019-2023,N Kenmore Ave And W Winona St,N Kenmore Ave And W Argyle St,"[41.9752669, -87.6563762]","[41.973255, -87.656328]",170310312004,170310312004
3223,3223,[170 -04] 39743,On N Kerbs Ave From N Caldwell Ave To N Kercheval Ave,2019-2023,N Kerbs Ave And N Caldwell Ave,N Kerbs Ave And N Kercheval Ave,"[41.9857616, -87.7419107]","[41.984904, -87.744615]",170311203003,170311203003
3224,3224,[170 -04] 39743,On N Kilpatrick Ave From N Elston Ave To N Kennison Ave,2019-2023,N Kilpatrick Ave And N Elston Ave,N Kilpatrick Ave And N Kennison Ave,"[41.9702524, -87.7436728]","[41.972284, -87.741067]",170311404005,170311404005
3225,3225,[170 -04] 39743,On N Kimball Ave From W Irving Park Rd To W Byron St,2019-2023,N Kimball Ave And W Irving Park Rd,N Kimball Ave And W Byron St,"[41.953814, -87.712889]","[41.952044, -87.712832]",170311608005,170311608005
3226,3226,[170 -04] 39743,On N Kolmar Ave From W Bryn Mawr Ave To N Rogers Ave,2019-2023,N Kolmar Ave And W Bryn Mawr Ave,N Kolmar Ave And N Rogers Ave,"[41.9826471, -87.7419257]","[41.9846782, -87.7419763]",170311203003,170311203003
3227,3227,[170 -04] 39743,On N Kostner Ave From W Devon Ave To W Rosemont Ave,2019-2023,N Kostner Ave And W Devon Ave,N Kostner Ave And W Rosemont Ave,"[41.997153, -87.738605]","[41.9953479, -87.7379761]",170311203005,170311203005
3228,3228,[170 -04] 39743,On N Lavergne Ave From W Ohio St To W Race Ave,2019-2023,N Lavergne Ave And W Ohio St,N Lavergne Ave And W Race Ave,"[41.8913482, -87.7505913]","[41.8904408, -87.7505406]",170312516001,170312516002
3229,3229,[170 -04] 39743,On N Lemont Ave From W Rosemont Ave To N Ionia Ave,2019-2023,N Lemont Ave And W Rosemont Ave,N Lemont Ave And N Ionia Ave,"[41.9956513, -87.7435147]","[41.9937274, -87.7451063]",170311203006,170311203006
3230,3230,[170 -04] 39743,On N Magnolia Ave From W Rosemont Ave To W Granville Ave,2019-2023,N Magnolia Ave And W Rosemont Ave,N Magnolia Ave And W Granville Ave,"[41.9963683, -87.6617444]","[41.9945423, -87.6616849]",170310302001,170310302001
3231,3231,[170 -04] 39743,On N Francisco Ave From W Ainslie St To W Argyle St,2019-2023,N Francisco Ave And W Ainslie St,N Francisco Ave And W Argyle St,"[41.970717, -87.701208]","[41.972151, -87.701251]",170310403003,170310403003
3232,3232,[170 -04] 39743,On S Aberdeen St From W Adams St To W Monroe St,2019-2023,S Aberdeen St And W Adams St,S Aberdeen St And W Monroe St,"[41.879124, -87.654604]","[41.880386, -87.654665]",170318331001,170318331001
3233,3233,[170 -04] 39743,On S Ada St From W 79th St To W 80th St,2019-2023,S Ada St And W 79th St,S Ada St And W 80th St,"[41.750444, -87.656992]","[41.748613, -87.657314]",170317107001,170317107002
3234,3234,[170 -04] 39743,On S May St From W Marquette Rd To W 69th St,2019-2023,S May St And W Marquette Rd,S May St And W 69th St,"[41.772365, -87.653107]","[41.768722, -87.652997]",170316810001,170316811005
3235,3235,[170 -04] 39743,On S Menard Ave From W 60th St To W 61st St,2019-2023,S Menard Ave And W 60th St,S Menard Ave And W 61st St,"[41.7834659, -87.7668125]","[41.7816259, -87.766733]",170316403004,170316403002
3236,3236,[170 -04] 39743,On S Menard Ave From W Railroad Ave To W Fillmore St,2019-2023,S Menard Ave And W Railroad Ave,S Menard Ave And W Fillmore St,"[41.8699922, -87.7694024]","[41.8673628, -87.7692604]",170318314002,170318314002
3237,3237,[170 -04] 39743,On S Miller St From W Polk St To W Taylor St,2019-2023,S Miller St And W Polk St,S Miller St And W Taylor St,"[41.8718602, -87.6522516]","[41.869488, -87.652216]",170318333001,170318333001
3238,3238,[170 -04] 39743,On S Morgan St From W 63rd St To W 64th St,2019-2023,S Morgan St And W 63rd St,S Morgan St And W 64th St,"[41.779686, -87.649649]","[41.7778681, -87.649608]",170316806002,170316810004
3239,3239,[170 -04] 39743,On S Morgan St From W Monroe St To W Adams St,2019-2023,S Morgan St And W Monroe St,S Morgan St And W Adams St,"[41.880436, -87.65199]","[41.879165, -87.651958]",170318331001,170318331001
3240,3240,[170 -04] 39743,On S Normal Ave From W 30th St To W 31st St,2019-2023,S Normal Ave And W 30th St,S Normal Ave And W 31st St,"[41.8399603, -87.639026]","[41.838164, -87.638975]",170318401002,170318401002
3241,3241,[170 -04] 39743,On S Oakley Ave From W 33rd St To W 34th St,2019-2023,S Oakley Ave And W 33rd St,S Oakley Ave And W 34th St,"[41.833943, -87.682677]","[41.832126, -87.682628]",170318403003,170318403003
3242,3242,[170 -04] 39743,On S Paulina St From W 81st St To W 85th St,2019-2023,S Paulina St And W 81st St,S Paulina St And W 85th St,"[41.746667, -87.6658]","[41.739373, -87.665587]",170317105002,170317112002
3243,3243,[170 -04] 39743,On S Peoria Dr From W 63rd St To W 64th St,2019-2023,S Peoria Dr And W 63rd St,S Peoria Dr And W 64th St,"[41.779743, -87.647202]","[41.77791, -87.647174]",170318348002,170316810004
3244,3244,[170 -04] 39743,On S Perry Ave From W 77th St To W 75th St,2019-2023,S Perry Ave And W 77th St,S Perry Ave And W 75th St,"[41.754527, -87.627919]","[41.758192, -87.628]",170316912002,170316911001
3245,3245,[170 -04] 39743,On S Princeton Ave From W 113th St To W 114th St,2019-2023,S Princeton Ave And W 113th St,S Princeton Ave And W 114th St,"[41.6888745, -87.6302005]","[41.687053, -87.630144]",170314913004,170314913003
3246,3246,[170 -04] 39743,On S Racine Ave From W 103rd St To W 104th St,2019-2023,S Racine Ave And W 103rd St,S Racine Ave And W 104th St,"[41.706829, -87.652563]","[41.7050091, -87.6525209]",170317306002,170317307002
3247,3247,[170 -04] 39743,On S Racine Ave From W 79th St To W 80th St,2019-2023,S Racine Ave And W 79th St,S Racine Ave And W 80th St,"[41.750498, -87.653762]","[41.748675, -87.653704]",170317107001,170317107002
3248,3248,[170 -04] 39743,On S Richmond St From W 79th St To W 80th St,2019-2023,S Richmond St And W 79th St,S Richmond St And W 80th St,"[41.749793, -87.696302]","[41.748073, -87.696234]",170317005014,170317005014
3249,3249,[170 -04] 39743,On S Rockwell St From W 70th St To W 71st St,2019-2023,S Rockwell St And W 70th St,S Rockwell St And W 71st St,"[41.766445, -87.688205]","[41.764616, -87.688148]",170316609003,170316610004
3250,3250,[170 -04] 39743,On S Sacramento Ave From W 79th St To W 80th St,2019-2023,S Sacramento Ave And W 79th St,S Sacramento Ave And W 80th St,"[41.749771, -87.697518]","[41.748058, -87.697469]",170317005014,170317005014
3251,3251,[170 -04] 39743,On S Sangamon St From W Monroe St To W Van Buren St,2019-2023,S Sangamon St And W Monroe St,S Sangamon St And W Van Buren St,"[41.880456, -87.65083]","[41.876648, -87.650725]",170318331001,170318331002
3252,3252,[170 -04] 39743,On S Sawyer Ave From W 46th St To S Archer Ave,2019-2023,S Sawyer Ave And W 46th St,S Sawyer Ave And S Archer Ave,"[41.809943, -87.70525]","[41.8134, -87.705434]",170315804002,170315804001
3253,3253,[170 -04] 39743,On S Seeley Ave From W 47th St To W 48th St,2019-2023,S Seeley Ave And W 47th St,S Seeley Ave And W 48th St,"[41.808531, -87.67594]","[41.806705, -87.675885]",170316103003,170316115001
3254,3254,[170 -04] 39743,On S State St From E 84th St To E 86th St,2019-2023,S State St And E 84th St,S State St And E 86th St,"[41.741845, -87.624312]","[41.73818, -87.624216]",170318424002,170318424002
3255,3255,[170 -04] 39743,On S Talman Ave From W 50th St To W 51st St,2019-2023,S Talman Ave And W 50th St,S Talman Ave And W 51st St,"[41.802898, -87.690384]","[41.801088, -87.690335]",170316302001,170316302001
3256,3256,[170 -04] 39743,On S Throop St From W 47th St To W 48th St,2019-2023,S Throop St And W 47th St,S Throop St And W 48th St,"[41.80874, -87.657691]","[41.806916, -87.657609]",170318426002,170316111001
3257,3257,[170 -04] 39743,On S May St From W 18th Pl To W 19th Pl,2019-2023,S May St And W 18th Pl,S May St And W 19th Pl,"[41.857321, -87.654839]","[41.855955, -87.654803]",170313105001,170313105001
3258,3258,[170 -04] 39743,On S Marshfield Ave From W 81st St To W 85th St,2019-2023,S Marshfield Ave And W 81st St,S Marshfield Ave And W 85th St,"[41.746688, -87.664587]","[41.739399, -87.664378]",170317105001,170317112002
