,Unnamed: 0,project_number,location_name,year_range,from,to,from_lat_long,to_lat_long,from_blockgroup,to_blockgroup
1132,1132,[170 -02] 41927,On N Laramie Ave From W Bloomingdale Ave To W Concord Pl,2019-2023,N Laramie Ave And W Bloomingdale Ave,N Laramie Ave And W Concord Pl,"[41.9131729, -87.7558008]","[41.91041, -87.755655]",170312503001,170312502001
1133,1133,[170 -02] 3204,On E 130th St From S Torrence Ave To S Brandon Ave,2015-2019,E 130th St And S Torrence Ave,E 130th St And S Brandon Ave,"[41.6585765, -87.5591909]","[41.658976137741, -87.5631430490206]",170315502002,170315502002
1134,1134,[170 -02] 3204,On S Brandon Ave From E 130th St To S Brainard Ave,2015-2019,S Brandon Ave And E 130th St,S Brandon Ave And S Brainard Ave,"[41.7492661500018, -87.5467837497093]","[41.648535, -87.546007]",170314601001,170315502002
1135,1135,[170 -02] 32926,On N Wolcott Ave From W Lawrence Ave To W Balmoral Ave,2015-2019,N Wolcott Ave And W Lawrence Ave,N Wolcott Ave And W Balmoral Ave,"[41.9688297, -87.6762187]","[41.979728, -87.676518]",170310404025,170310401001
1136,1136,[170 -02] 32926,On W Foster Ave From N Wolcott Ave To N Ravenswood Ave,2015-2019,W Foster Ave And N Wolcott Ave,W Foster Ave And N Ravenswood Ave,"[41.9760901, -87.6764218]","[41.9761161, -87.6743967]",170310401002,170310309004
1137,1137,[170 -02] 32926,On N Wolcott Ave From W Lawrence Ave To W Winnemac Ave,2015-2019,N Wolcott Ave And W Lawrence Ave,N Wolcott Ave And W Winnemac Ave,"[41.9688297, -87.6762187]","[42.0193747, -87.6776559500011]",170310404025,170310102012
1138,1138,[170 -02] 33346,On N Lavergne Ave From W Lawrence Ave To W Montrose Ave,2015-2019,N Lavergne Ave And W Lawrence Ave,N Lavergne Ave And W Montrose Ave,"[41.9679628, -87.7526526]","[41.960674, -87.752378]",170311502002,170311502004
1139,1139,[170 -02] 33346,N Cicero Ave And W Lawrence Ave,2015-2019,N Cicero Ave And W Lawrence Ave,None,"[41.968033, -87.7477398]",None,170311204003,None
1140,1140,[170 -02] 33467,On W Lawrence Ave From N Oakley Ave To N Leavitt St,2015-2019,W Lawrence Ave And N Oakley Ave,W Lawrence Ave And N Leavitt St,"[41.9686202, -87.686456]","[41.9686617, -87.6840145]",170310406003,170310406003
1141,1141,[170 -02] 35683,On E 69th St From S Langley Ave To S St Lawrence Ave,2015-2019,E 69th St And S Langley Ave,E 69th St And S St Lawrence Ave,"[41.7694538, -87.6081473]","[41.76937890000001, -87.61046285]",170314212002,170314212002
1142,1142,[170 -02] 35683,On S Langley Ave From E 68th St To E 67th St,2015-2019,S Langley Ave And E 68th St,S Langley Ave And E 67th St,"[41.77127, -87.608168]","[41.773078, -87.608196]",170314212002,170314212001
1143,1143,[170 -02] 36040,W 76th St And S Halsted St,2015-2019,W 76th St And S Halsted St,None,"[41.756095, -87.644186]",None,170317102001,None
1144,1144,[170 -02] 36040,613-700 W 77th St,2015-2019,613 W 77th St,700 W 77th St,"[41.75429874915207, -87.64018874042996]","[41.75434763177717, -87.64211784388156]",170317101001,170317101001
1145,1145,[170 -02] 36040,W 78th St And S Emerald Ave,2015-2019,W 78th St And S Emerald Ave,None,"[41.752483, -87.642861]",None,170317101001,None
1146,1146,[170 -02] 36338,On S Avenue O From E 133rd St To E 135th St,2015-2019,S Avenue O And E 133rd St,S Avenue O And E 135th St,"[41.6536703, -87.539947]","[41.650015, -87.539887]",170315501001,170315501003
1147,1147,[170 -02] 37792,On S Halsted St From W 75th St To W 78th St,2015-2019,S Halsted St And W 75th St,S Halsted St And W 78th St,"[41.75773, -87.644232]","[41.752467, -87.644107]",170317102001,170317102001
1148,1148,[170 -02] 37792,W Altgeld St And N Keeler Ave,2015-2019,W Altgeld St And N Keeler Ave,None,"[41.926278, -87.731727]",None,170312002002,None
1149,1149,[170 -02] 37792,W 60th St And S Hamlin Ave,2015-2019,W 60th St And S Hamlin Ave,None,"[41.78419, -87.718014]",None,170316501004,None
1150,1150,[170 -02] 37792,W 52nd St And S Kostner Ave,2015-2019,W 52nd St And S Kostner Ave,None,"[41.798634, -87.733069]",None,170315705001,None
1151,1151,[170 -02] 37792,S Halsted St And W 77th St,2015-2019,S Halsted St And W 77th St,None,"[41.754274, -87.644137]",None,170317101001,None
1152,1152,[170 -02] 37792,W Cullom Ave And N Ravenswood Ave,2015-2019,W Cullom Ave And N Ravenswood Ave,None,"[41.9597087, -87.6739219]",None,170310602001,None
1153,1153,[170 -02] 37792,N Maplewood Ave And W North Shore Ave,2015-2019,N Maplewood Ave And W North Shore Ave,None,"[42.003106, -87.693702]",None,170310206024,None
1154,1154,[170 -02] 37792,N Hamlin Ave And W Addison St,2015-2019,N Hamlin Ave And W Addison St,None,"[41.9464643, -87.7225141]",None,170311609002,None
1155,1155,[170 -02] 37792,E 90th St And S Constance Ave,2015-2019,E 90th St And S Constance Ave,None,"[41.731547, -87.579237]",None,170314804007,None
1156,1156,[170 -02] 37792,N Rockwell St And W Foster Ave,2015-2019,N Rockwell St And W Foster Ave,None,"[41.975853, -87.694081]",None,170310402012,None
1157,1157,[170 -02] 37792,W Belle Plaine Ave And N Albany Ave,2015-2019,W Belle Plaine Ave And N Albany Ave,None,"[41.955766, -87.705628]",None,170311606022,None
1158,1158,[170 -02] 37792,E 118th St And S Prairie Ave,2015-2019,E 118th St And S Prairie Ave,None,"[41.6799325, -87.6166124]",None,170315301001,None
1159,1159,[170 -02] 37792,N Fairfield Ave And W Albion Ave,2015-2019,N Fairfield Ave And W Albion Ave,None,"[42.0012269, -87.6985183]",None,170310206011,None
1160,1160,[170 -02] 37792,N Keystone Ave And W Glenlake Ave,2015-2019,N Keystone Ave And W Glenlake Ave,None,"[41.991817, -87.730092]",None,170311302001,None
1161,1161,[170 -02] 37792,N Nordica Ave And W Berwyn Ave,2015-2019,N Nordica Ave And W Berwyn Ave,None,"[41.9771064, -87.8023918]",None,170311006003,None
1162,1162,[170 -02] 37792,S Genoa Ave And W 98th St,2015-2019,S Genoa Ave And W 98th St,None,"[41.715811, -87.651374]",None,170317304003,None
1163,1163,[170 -02] 37792,S Parnell Ave And W 129th Pl,2015-2019,S Parnell Ave And W 129th Pl,None,"[41.6581666, -87.6352261]",None,170315305033,None
1164,1164,[170 -02] 37792,W 57th St And S Kedzie Ave,2015-2019,W 57th St And S Kedzie Ave,None,"[41.789905, -87.703442]",None,170316308002,None
1165,1165,[170 -02] 37792,W 70th St And S Ashland Ave,2015-2019,W 70th St And S Ashland Ave,None,"[41.766749, -87.663802]",None,170316716002,None
1166,1166,[170 -02] 37792,W Hunt Ave And S Longwood Dr,2015-2019,W Hunt Ave And S Longwood Dr,None,"[41.7333934, -87.6735862]",None,170317201002,None
1167,1167,[170 -02] 37793,On E 72nd St From S Phillips Ave To S Exchange Ave,2015-2019,E 72nd St And S Phillips Ave,E 72nd St And S Exchange Ave,"[41.764439, -87.565772]","[41.764481, -87.565161]",170314307002,170314307002
1168,1168,[170 -02] 37793,W 116th St And S Western Ave,2015-2019,W 116th St And S Western Ave,None,"[41.682726, -87.680803]",None,170317505002,None
1169,1169,[170 -02] 37793,S Marshfield Ave And W 88th St,2015-2019,S Marshfield Ave And W 88th St,None,"[41.733971, -87.66427]",None,170317113001,None
1170,1170,[170 -02] 37793,N Merrimac Ave And W Dickens Ave,2015-2019,N Merrimac Ave And W Dickens Ave,None,"[41.9182736, -87.7815992]",None,170311913012,None
1171,1171,[170 -02] 37793,On W North Shore Ave From N Western Ave To N Talman Ave,2015-2019,W North Shore Ave And N Western Ave,W North Shore Ave And N Talman Ave,"[42.0032061, -87.6899863]","[42.003061, -87.696163]",170310205003,170310206024
1172,1172,[170 -02] 37793,On W Belle Plaine Ave From N Whipple St To N Sacramento Ave,2015-2019,W Belle Plaine Ave And N Whipple St,W Belle Plaine Ave And N Sacramento Ave,"[41.955762, -87.70442]","[41.955763, -87.703187]",170311606022,170311606021
1173,1173,[170 -02] 37793,On W Belle Plaine Ave From N Troy St To N Kedzie Ave,2015-2019,W Belle Plaine Ave And N Troy St,W Belle Plaine Ave And N Kedzie Ave,"[41.955759, -87.706844]","[41.955753, -87.708059]",170311606022,170311606022
1174,1174,[170 -02] 37793,On W Belle Plaine Ave From N Lawndale Ave To N Ridgeway Ave,2015-2019,W Belle Plaine Ave And N Lawndale Ave,W Belle Plaine Ave And N Ridgeway Ave,"[41.9555911, -87.7203285]","[41.955573, -87.721539]",170311604001,170311604001
1175,1175,[170 -02] 37793,On W Altgeld St From N Sawyer Ave To N Kedzie Blvd,2015-2019,W Altgeld St And N Sawyer Ave,W Altgeld St And N Kedzie Blvd,"[41.926529, -87.709329]","[41.926533, -87.707606]",170312206021,170312206021
1176,1176,[170 -02] 37793,On W 91st St From S Laflin St To S Bishop St,2015-2019,W 91st St And S Laflin St,W 91st St And S Bishop St,"[41.72855, -87.660391]","[41.728574, -87.659197]",170317302014,170317302013
1177,1177,[170 -02] 37793,On W 70th St From S Justine St To S Bishop St,2015-2019,W 70th St And S Justine St,W 70th St And S Bishop St,"[41.766755, -87.662681]","[41.766794, -87.660249]",170316716002,170316716002
1178,1178,[170 -02] 37793,On W 64th St From S Damen Ave To S Paulina St,2015-2019,W 64th St And S Damen Ave,W 64th St And S Paulina St,"[41.777531, -87.673858]","[41.7776292, -87.6666575]",170316714001,170316712002
1179,1179,[170 -02] 37793,On W 46th St From S Harding Ave To S Hamlin Ave,2015-2019,W 46th St And S Harding Ave,W 46th St And S Hamlin Ave,"[41.8097244, -87.7224348]","[41.8097519, -87.7187114]",170315701001,170315701001
1180,1180,[170 -02] 37793,On W 18th St From S Racine Ave To S Throop St,2015-2019,W 18th St And S Racine Ave,W 18th St And S Throop St,"[41.857971, -87.656436]","[41.857935, -87.658881]",170313106001,170313106001
1181,1181,[170 -02] 37793,On W 17th St From S Laflin St To S Ashland Ave,2015-2019,W 17th St And S Laflin St,W 17th St And S Ashland Ave,"[41.858753, -87.663774]","[41.85871, -87.666256]",170313106001,170313108001
1182,1182,[170 -02] 37793,On W 117th St From S Watkins Ave To S Church St,2015-2019,W 117th St And S Watkins Ave,W 117th St And S Church St,"[41.681216, -87.668388]","[41.681954, -87.670627]",170317505004,170317505004
1183,1183,[170 -02] 37793,5400-5482 S Ridgewood Ct,2015-2019,5400 S Ridgewood Ct,5482 S Ridgewood Ct,"[41.79789683576531, -87.5926739233341]","[41.7956927, -87.5928894]",170314107001,170314107001
1184,1184,[170 -02] 37793,On S Longwood Dr From W 119th St To W 116th St,2015-2019,S Longwood Dr And W 119th St,S Longwood Dr And W 116th St,"[41.67728, -87.675225]","[41.682878, -87.674099]","[41.67728, -87.675225]",170317505004
1185,1185,[170 -02] 37793,On W 115th St From S St Louis Ave To S Homan Ave,2015-2019,W 115th St And S St Louis Ave,W 115th St And S Homan Ave,"[41.68416, -87.707874]","[41.684193, -87.705427]",170317404003,170317404002
1186,1186,[170 -02] 37793,On E 75th St From S Langley Ave To S Cottage Grove Ave,2015-2019,E 75th St And S Langley Ave,E 75th St And S Cottage Grove Ave,"[41.758519, -87.607855]","[41.75857, -87.605404]",170316914001,170316914001
1187,1187,[170 -02] 37793,On E 87th St From S Constance Ave To S Euclid Ave,2015-2019,E 87th St And S Constance Ave,E 87th St And S Euclid Ave,"[41.736999, -87.579361]","[41.737033, -87.576951]",170314801002,170314801002
1188,1188,[170 -02] 37793,On N Hamlin Ave From W Addison St To W Cornelia Ave,2015-2019,N Hamlin Ave And W Addison St,N Hamlin Ave And W Cornelia Ave,"[41.9464643, -87.7225141]","[41.944601, -87.722454]",170311609002,170318311003
1189,1189,[170 -02] 37793,On N Kilpatrick Ave From W Chicago Ave To W Augusta Blvd,2015-2019,N Kilpatrick Ave And W Chicago Ave,N Kilpatrick Ave And W Augusta Blvd,"[41.895072, -87.743519]","[41.898767, -87.743586]",170312510001,170312510001
1190,1190,[170 -02] 37793,On N Mulligan Ave From W Grand Ave To W Palmer St,2015-2019,N Mulligan Ave And W Grand Ave,N Mulligan Ave And W Palmer St,"[41.9222862, -87.7841795]","[41.920319, -87.7841321]",170311913011,170311913013
1191,1191,[170 -02] 37793,On N Paulina St From W Montrose Ave To W Cullom Ave,2015-2019,N Paulina St And W Montrose Ave,N Paulina St And W Cullom Ave,"[41.961589, -87.670822]","[41.959754, -87.670764]",170310319002,170310602001
1192,1192,[170 -02] 37793,On N Meade Ave From W Addison St To W Cornelia Ave,2015-2019,N Meade Ave And W Addison St,N Meade Ave And W Cornelia Ave,"[41.9457438, -87.7789381]","[41.943924, -87.778841]",170311711001,170311711001
1193,1193,[170 -02] 37793,On N Sedgwick St From W Chicago Ave To W Oak St,2015-2019,N Sedgwick St And W Chicago Ave,N Sedgwick St And W Oak St,"[41.896554, -87.638562]","[41.88322830200195, -87.63240051269531]",170310818002,170318391001
1194,1194,[170 -02] 37793,On N Whipple St From W Berteau Ave To W Belle Plaine Ave,2015-2019,N Whipple St And W Berteau Ave,N Whipple St And W Belle Plaine Ave,"[41.957571, -87.704482]","[41.955762, -87.70442]",170311606022,170311606022
1195,1195,[170 -02] 37793,On S Christiana Ave From W 82nd St To W 83rd St,2015-2019,S Christiana Ave And W 82nd St,S Christiana Ave And W 83rd St,"[41.7442662, -87.705902]","[41.742455, -87.7058429]",170317004014,170317004014
1196,1196,[170 -02] 37793,On S Constance Ave From E 87th St To E 90th St,2015-2019,S Constance Ave And E 87th St,S Constance Ave And E 90th St,"[41.736999, -87.579361]","[41.731547, -87.579237]",170314801002,170314804007
1197,1197,[170 -02] 37793,On S Genoa Ave From W 98th St To W 96th St,2015-2019,S Genoa Ave And W 98th St,S Genoa Ave And W 96th St,"[41.715811, -87.651374]","[41.719245, -87.650105]",170317304003,170317304001
1198,1198,[170 -02] 37793,On S Kingston Ave From E 74th St To E 75th St,2015-2019,S Kingston Ave And E 74th St,S Kingston Ave And E 75th St,"[41.76086, -87.563224]","[41.759041, -87.56274]",170314313021,170314313021
1199,1199,[170 -02] 37793,On N Rockwell St From W Berwyn Ave To W Foster Ave,2015-2019,N Rockwell St And W Berwyn Ave,N Rockwell St And W Foster Ave,"[41.977672, -87.69412]","[41.975853, -87.694081]",170310402022,170310402012
1200,1200,[170 -02] 37793,On W 87th St From S Winchester Ave To S Honore St,2015-2019,W 87th St And S Winchester Ave,W 87th St And S Honore St,"[41.735724, -87.670975]","[41.735654, -87.669165]",170317112004,170317113001
1201,1201,[170 -02] 37793,On W 18th St From S Loomis St To S Throop St,2015-2019,W 18th St And S Loomis St,W 18th St And S Throop St,"[41.857895, -87.661144]","[41.857935, -87.658881]",170313106001,170313106001
1202,1202,[170 -02] 37793,On W 25th St From S Pulaski Rd To S Avers Ave,2015-2019,W 25th St And S Pulaski Rd,W 25th St And S Avers Ave,"[41.84608, -87.724605]","[41.846139, -87.720924]",170313005002,170313005002
1203,1203,[170 -02] 37793,On W 58th St From S Damen Ave To S Hoyne Ave,2015-2019,W 58th St And S Damen Ave,W 58th St And S Hoyne Ave,"[41.78848, -87.67415]","[41.788455, -87.676595]",170316705001,170316705001
1204,1204,[170 -02] 37793,On W 70th St From S Ashland Ave To S Justine St,2015-2019,W 70th St And S Ashland Ave,W 70th St And S Justine St,"[41.766749, -87.663802]","[41.766755, -87.662681]",170316716002,170316716002
1205,1205,[170 -02] 37793,On W 96th St From S Genoa Ave To S Carpenter St,2015-2019,W 96th St And S Genoa Ave,W 96th St And S Carpenter St,"[41.719245, -87.650105]","[41.719252, -87.649227]",170317304001,170317304001
1206,1206,[170 -02] 37793,On W Belle Plaine Ave From N Sacramento Ave To N Richmond St,2015-2019,W Belle Plaine Ave And N Sacramento Ave,W Belle Plaine Ave And N Richmond St,"[41.955763, -87.703187]","[41.95577, -87.701966]",170311606021,170311606023
1207,1207,[170 -02] 37793,On W Belle Plaine Ave From N Whipple St To N Albany Ave,2015-2019,W Belle Plaine Ave And N Whipple St,W Belle Plaine Ave And N Albany Ave,"[41.955762, -87.70442]","[41.955766, -87.705628]",170311606022,170311606022
1208,1208,[170 -02] 37793,On W Cullerton St From S Loomis St To S Throop St,2015-2019,W Cullerton St And S Loomis St,W Cullerton St And S Throop St,"[41.8551601, -87.6612441]","[41.855186, -87.658781]",170313106003,170313106003
1209,1209,[170 -02] 37793,On W Palmer St From N Mulligan Ave To N Natchez Ave,2015-2019,W Palmer St And N Mulligan Ave,W Palmer St And N Natchez Ave,"[41.920319, -87.7841321]","[41.9200271, -87.7877349]",170311913013,170318315002
1210,1210,[170 -02] 37793,S Hermitage Ave And W 88th St,2015-2019,S Hermitage Ave And W 88th St,None,"[41.733911, -87.66668]",None,170317113002,None
1211,1211,[170 -02] 37793,On W 123rd St From S Carpenter St To S Peoria St,2015-2019,W 123rd St And S Carpenter St,W 123rd St And S Peoria St,"[41.670445, -87.647756]","[41.6705106, -87.6440745]","[41.670445, -87.647756]",170315304001
1212,1212,[170 -02] 37793,On W Belle Plaine Ave From N Albany Ave To N Troy St,2015-2019,W Belle Plaine Ave And N Albany Ave,W Belle Plaine Ave And N Troy St,"[41.955766, -87.705628]","[41.955759, -87.706844]",170311606022,170311606022
1213,1213,[170 -02] 37793,On W 116th Pl From S Western Ave To S Bell Ave,2015-2019,W 116th Pl And S Western Ave,W 116th Pl And S Bell Ave,"[41.681583, -87.68076]","[41.682107, -87.677318]",170317505002,170317505002
1214,1214,[170 -02] 37793,On N Rockwell St From W Berwyn Ave To W Summerdale Ave,2015-2019,N Rockwell St And W Berwyn Ave,N Rockwell St And W Summerdale Ave,"[41.977672, -87.69412]","[41.9785725, -87.6941491]",170310402022,170310402022
1215,1215,[170 -02] 37793,On S Langley Ave From E 69th St To E 67th St,2015-2019,S Langley Ave And E 69th St,S Langley Ave And E 67th St,"[41.7694538, -87.6081473]","[41.773078, -87.608196]",170314212002,170314212001
1216,1216,[170 -02] 37793,W North Shore Ave And N Maplewood Ave,2015-2019,W North Shore Ave And N Maplewood Ave,None,"[42.003106, -87.693702]",None,170310206024,None
1217,1217,[170 -02] 37793,On E 75th St From S Kingston Ave To S Phillips Ave,2015-2019,E 75th St And S Kingston Ave,E 75th St And S Phillips Ave,"[41.75903, -87.563149]","[41.759008, -87.564763]",170314313021,"[41.759008, -87.564763]"
1218,1218,[170 -02] 37793,On E 75th St From S Rhodes Ave To S Champlain Ave,2015-2019,E 75th St And S Rhodes Ave,E 75th St And S Champlain Ave,"[41.758454, -87.611489]","[41.758495, -87.609052]",170316914004,170316914004
1219,1219,[170 -02] 37793,On E 88th St From S Constance Ave To S Euclid Ave,2015-2019,E 88th St And S Constance Ave,E 88th St And S Euclid Ave,"[41.73521, -87.57932]","[41.735217, -87.576897]",170314801002,170314801002
1220,1220,[170 -02] 37793,On N Hudson Ave From W Chicago Ave To W Oak St,2015-2019,N Hudson Ave And W Chicago Ave,N Hudson Ave And W Oak St,"[41.896489, -87.640047]","[41.9004555, -87.6400528]",170310819001,170310819001
1221,1221,[170 -02] 37793,On N Marmora Ave From W Addison St To W Newport Ave,2015-2019,N Marmora Ave And W Addison St,N Marmora Ave And W Newport Ave,"[41.945807, -87.774042]","[41.943056, -87.77393]",170311506003,170311512003
1222,1222,[170 -02] 37793,On S Wolcott Ave From W 77th St To W 78th St,2015-2019,S Wolcott Ave And W 77th St,S Wolcott Ave And W 78th St,"[41.753942, -87.670814]","[41.752071, -87.670768]",170317104005,170317104006
1223,1223,[170 -02] 37793,On N Meade Ave From W Belmont Ave To W Henderson St,2015-2019,N Meade Ave And W Belmont Ave,N Meade Ave And W Henderson St,"[41.93843, -87.778616]","[41.941169, -87.778739]",170311711002,170311711002
1224,1224,[170 -02] 37793,On N Ridgeway Ave From W Berteau Ave To N Elston Ave,2015-2019,N Ridgeway Ave And W Berteau Ave,N Ridgeway Ave And N Elston Ave,"[41.9573876, -87.7216032]","[41.955333, -87.721529]",170311604001,170311604002
1225,1225,[170 -02] 37793,On N Washtenaw Ave From W Berwyn Ave To W Foster Ave,2015-2019,N Washtenaw Ave And W Berwyn Ave,N Washtenaw Ave And W Foster Ave,"[41.977669, -87.696562]","[42.01914485, -87.697255550009]",170310402022,170310202004
1226,1226,[170 -02] 37793,On S Bishop St From W 92nd St To W 91st St,2015-2019,S Bishop St And W 92nd St,S Bishop St And W 91st St,"[41.726753, -87.659207]","[41.728574, -87.659197]",170317302014,170317302013
1227,1227,[170 -02] 37793,On S Colfax Ave From E 74th St To E 75th St,2015-2019,S Colfax Ave And E 74th St,S Colfax Ave And E 75th St,"[41.760847, -87.562493]","[41.7590531, -87.5615821]",170314313021,170314313021
1228,1228,[170 -02] 37793,On S Evans Ave From E 74th St To E 75th St,2015-2019,S Evans Ave And E 74th St,S Evans Ave And E 75th St,"[41.760365, -87.606687]","[41.758542, -87.606638]",170316909002,170316914001
1229,1229,[170 -02] 37793,On S Harding Ave From W 47th St To W 46th St,2015-2019,S Harding Ave And W 47th St,S Harding Ave And W 46th St,"[41.807909, -87.722373]","[41.8097244, -87.7224348]",170315701001,170315701001
1230,1230,[170 -02] 37793,On N Olcott Ave From W Palatine Ave To W Devon Ave,2015-2019,N Olcott Ave And W Palatine Ave,N Olcott Ave And W Devon Ave,"[41.9954616, -87.8136394]","[41.997074, -87.813567]",170311003005,170310903001
1231,1231,[170 -02] 37793,2232-2400 W 116th St,2015-2019,2232 W 116th St,2400 W 116th St,"[41.68276198750201, -87.68183757362848]","[41.68275342561983, -87.68237678722356]",170317504002,170317504002
1232,1232,[170 -02] 37794,On E 100th St From S Avenue N To S Ewing Ave,2015-2019,E 100th St And S Avenue N,E 100th St And S Ewing Ave,"[41.713861, -87.538895]","[41.7135376, -87.535274]",170315202003,"[41.7135376, -87.535274]"
1233,1233,[170 -02] 37794,On W 53rd St From S Richmond St To S Kedzie Ave,2015-2019,W 53rd St And S Richmond St,W 53rd St And S Kedzie Ave,"[41.7972868, -87.6975644]","[41.7971428, -87.7036535]",170316304001,170316304003
1234,1234,[170 -02] 37794,On W 58th St From S Halsted St To S Carpenter St,2015-2019,W 58th St And S Halsted St,W 58th St And S Carpenter St,"[41.788861, -87.645025]","[41.788789, -87.651058]",170318347001,170316805002
1235,1235,[170 -02] 37794,On W 73rd St From S Whipple St To S Kedzie Ave,2015-2019,W 73rd St And S Whipple St,W 73rd St And S Kedzie Ave,"[41.7607989, -87.6990261]","[41.760748, -87.702544]",170316611003,170316611003
1236,1236,[170 -02] 37794,On W 81st Pl From S Kostner Ave To S Kenneth Ave,2015-2019,W 81st Pl And S Kostner Ave,W 81st Pl And S Kenneth Ave,"[41.7440317, -87.7311419]","[41.744916, -87.7329643]",170317003013,170317003013
1237,1237,[170 -02] 37794,On W 81st St From S Kilpatrick Ave To S Keating Ave,2015-2019,W 81st St And S Kilpatrick Ave,W 81st St And S Keating Ave,"[41.7457647, -87.7386949]","[41.7456489, -87.7395304]",170317003013,170317003013
1238,1238,[170 -02] 37794,On W Ardmore Ave From N Austin Ave To N Melvina Ave,2015-2019,W Ardmore Ave And N Austin Ave,W Ardmore Ave And N Melvina Ave,"[41.9865498, -87.7779736]","[41.9864891, -87.7828064]",170311001003,170311001003
1239,1239,[170 -02] 37794,On W Arthur Ave From N Troy St To N Albany Ave,2015-2019,W Arthur Ave And N Troy St,W Arthur Ave And N Albany Ave,"[41.999239, -87.708247]","[41.999248, -87.707029]",170310203012,170310206012
1240,1240,[170 -02] 37794,On W Barry Ave From N Springfield Ave To N Davlin Ct,2015-2019,W Barry Ave And N Springfield Ave,W Barry Ave And N Davlin Ct,"[41.9373185, -87.7259059]","[41.936691, -87.724922]",170312105012,170312105012
1241,1241,[170 -02] 37794,On W Carmen Ave From N Ravenswood Ave To N Paulina St,2015-2019,W Carmen Ave And N Ravenswood Ave,W Carmen Ave And N Paulina St,"[41.974253, -87.6743631]","[41.88322830200195, -87.63240051269531]",170310404021,170318391001
1242,1242,[170 -02] 37794,On W Jackson Blvd From S California Ave To S Francisco Ave,2015-2019,W Jackson Blvd And S California Ave,W Jackson Blvd And S Francisco Ave,"[41.877461, -87.696199]","[41.877434, -87.698659]",170318370001,170318370001
1243,1243,[170 -02] 37794,On W Madison St From N Waller Ave To N Mason Ave,2015-2019,W Madison St And N Waller Ave,W Madison St And N Mason Ave,"[41.880259, -87.768081]","[41.880172, -87.77319]",170312520002,170312520003
1244,1244,[170 -02] 37794,On W Palmer St From N Cicero Ave To N Kilpatrick Ave,2015-2019,W Palmer St And N Cicero Ave,W Palmer St And N Kilpatrick Ave,"[41.920602, -87.746281]","[41.9206205, -87.7437499]",170311911001,170311910001
1245,1245,[170 -02] 37794,On W Peterson Ave From N Harlem Ave To N Oconto Ave,2015-2019,W Peterson Ave And N Harlem Ave,W Peterson Ave And N Oconto Ave,"[41.9900141, -87.8068995]","[41.9899373, -87.8083246]",170311003006,170311003002
1246,1246,[170 -02] 37794,On W Winona St From N Ravenswood Ave To N Paulina St,2015-2019,W Winona St And N Ravenswood Ave,W Winona St And N Paulina St,"[41.974803, -87.674903]","[41.975193, -87.672035]",170310404021,170310310001
1247,1247,[170 -02] 37794,N Mayfield Ave And W Madison St,2015-2019,N Mayfield Ave And W Madison St,None,"[41.880088, -87.771732]",None,170312521011,None
1248,1248,[170 -02] 37794,S Austin Blvd And W Roosevelt Rd,2015-2019,S Austin Blvd And W Roosevelt Rd,None,"[41.865464, -87.774103]",None,170318314002,None
1249,1249,[170 -02] 37794,S Mayfield Ave And W Roosevelt Rd,2015-2019,S Mayfield Ave And W Roosevelt Rd,None,"[41.865507, -87.771639]",None,170318314002,None
1250,1250,[170 -02] 37794,On W 18th St From S Wentworth Ave To S Clark St,2015-2019,W 18th St And S Wentworth Ave,W 18th St And S Clark St,"[41.857752, -87.6318983]","[41.857787, -87.630227]",170318411001,170313302002
1251,1251,[170 -02] 37794,On S St Louis Ave From W 81st Pl To W Columbus Ave,2015-2019,S St Louis Ave And W 81st Pl,S St Louis Ave And W Columbus Ave,"[41.74515, -87.709606]","[41.745012, -87.709608]",170317004011,170317004011
1252,1252,[170 -02] 37794,On S St Louis Ave From W 77th St To W 78th St,2015-2019,S St Louis Ave And W 77th St,S St Louis Ave And W 78th St,"[41.7533332, -87.7098137]","[41.7515163, -87.70976]",170317001001,170317001001
1253,1253,[170 -02] 37794,On S Scottsdale Ave From W 81st St To S Knox Ave,2015-2019,S Scottsdale Ave And W 81st St,S Scottsdale Ave And S Knox Ave,"[41.7400379495497, -87.734722665054]","[41.7462465, -87.7378105]",170317003023,170317003013
1254,1254,[170 -02] 37794,On E 88th St From S East End Ave To S Constance Ave,2015-2019,E 88th St And S East End Ave,E 88th St And S Constance Ave,"[41.735135, -87.582849]","[41.73521, -87.57932]",170314801002,170314801002
1255,1255,[170 -02] 37794,On E 99th St From S Ewing Ave To S Avenue J,2015-2019,E 99th St And S Ewing Ave,E 99th St And S Avenue J,"[41.715797, -87.535281]","[41.715841, -87.534026]",170315202003,170315201001
