,Unnamed: 0,project_number,location_name,year_range,from,to,from_lat_long,to_lat_long,from_blockgroup,to_blockgroup
2216,2216,[170 -04] 38342,On S Homan Ave From W 16th St To W 26th St,2017-2021,S Homan Ave And W 16th St,S Homan Ave And W 26th St,"[41.8590254, -87.7103414]","[41.844478, -87.709893]",170312912001,170313008002
2217,2217,[170 -04] 38342,On S Lawndale Ave From W 15th St To W 16th St,2017-2021,S Lawndale Ave And W 15th St,S Lawndale Ave And W 16th St,"[41.8607891, -87.7176895]","[41.858967, -87.71766]",170318387004,170318387004
2218,2218,[170 -04] 38342,On S Lawndale Ave From W 26th St To W 31st St,2017-2021,S Lawndale Ave And W 26th St,S Lawndale Ave And W 31st St,"[41.844361, -87.717233]","[41.837016, -87.717025]",170313006002,170313017023
2219,2219,[170 -04] 38342,On S Luella Ave From E 89th St To E 90th St,2017-2021,S Luella Ave And E 89th St,S Luella Ave And E 90th St,"[41.7335162, -87.5695544]","[41.731669, -87.569473]",170314801001,170314804001
2220,2220,[170 -04] 38342,On S Michigan Ave From E 81st St To E 82nd St,2017-2021,S Michigan Ave And E 81st St,S Michigan Ave And E 82nd St,"[41.7473837, -87.6212859]","[41.745532, -87.621249]",170314403005,170314403005
2221,2221,[170 -04] 38342,On S Millard Ave From W 15th St To W 16th St,2017-2021,S Millard Ave And W 15th St,S Millard Ave And W 16th St,"[41.860813, -87.71648]","[41.858978, -87.716428]",170318387004,170318387004
2222,2222,[170 -04] 38342,On S Clyde Ave From E 99th St To E 100th St,2017-2021,S Clyde Ave And E 99th St,S Clyde Ave And E 100th St,"[41.715252, -87.571836]","[41.713398, -87.571842]",170315103004,170315103004
2223,2223,[170 -04] 38342,On N Ottawa Ave From W Cornelia Ave To W School St,2017-2021,N Ottawa Ave And W Cornelia Ave,N Ottawa Ave And W School St,"[41.94324, -87.817903]","[41.939605, -87.817772]",170311708003,170311708003
2224,2224,[170 -04] 38342,On S Paulina St From W Harrison St To W Polk St,2017-2021,S Paulina St And W Harrison St,S Paulina St And W Polk St,"[41.8741357, -87.6691122]","[41.871607, -87.669026]",170318382002,170318382002
2225,2225,[170 -04] 38342,On N Opal Ave From W Addison St To W School St,2017-2021,N Opal Ave And W Addison St,N Opal Ave And W School St,"[41.945139, -87.822892]","[41.939502, -87.822657]",170311705001,170311707002
2226,2226,[170 -04] 38342,On E 84th Pl From S Stony Island Ave To S Cregier Ave,2017-2021,E 84th Pl And S Stony Island Ave,E 84th Pl And S Cregier Ave,"[41.741471, -87.585312]","[41.741526, -87.580614]",170314503001,170314503002
2227,2227,[170 -04] 38342,On E 86th St From S Dante Ave To S Blackstone Ave,2017-2021,E 86th St And S Dante Ave,E 86th St And S Blackstone Ave,"[41.738685, -87.589117]","[41.738696, -87.587922]",170318343004,170318343004
2228,2228,[170 -04] 38342,On E 89th St From S State St To S Indiana Ave,2017-2021,E 89th St And S State St,E 89th St And S Indiana Ave,"[41.7326968, -87.6240517]","[41.732789, -87.619268]",170318424002,170314406001
2229,2229,[170 -04] 38342,On E 93rd St From S Harper Ave To S Stony Island Ave,2017-2021,E 93rd St And S Harper Ave,E 93rd St And S Stony Island Ave,"[41.725953, -87.586673]","[41.725989, -87.585426]",170314803002,170314803002
2230,2230,[170 -04] 38342,On N Ashland Ave From W Wellington Ave To W Diversey Pkwy,2017-2021,N Ashland Ave And W Wellington Ave,N Ashland Ave And W Diversey Pkwy,"[41.9360246, -87.6685913]","[41.932443, -87.66832]",170310626001,170310627002
2231,2231,[170 -04] 38342,3214-3400 N Pioneer Ave,2018-2022,3214 N Pioneer Ave,3400 N Pioneer Ave,"[41.937992416934684, -87.83127767067415]","[41.941196, -87.831721]",170311706002,170311706002
2232,2232,[170 -04] 38342,On N Austin Ave From W Peterson Ave To N Milwaukee Ave,2017-2021,N Austin Ave And W Peterson Ave,N Austin Ave And N Milwaukee Ave,"[41.9901834, -87.7779227]","[41.9868834, -87.7779674]",170311001002,170311001002
2233,2233,[170 -04] 38342,On N Osceola Ave From W Forest Preserve Ave To W Wellington Ave,2017-2021,N Osceola Ave And W Forest Preserve Ave,N Osceola Ave And W Wellington Ave,"[41.951045, -87.812975]","[41.934412, -87.812709]",170311704004,170311709001
2234,2234,[170 -04] 38342,On N Central Ave From N Leonard Ave To N Manton Ave,2017-2021,N Central Ave And N Leonard Ave,N Central Ave And N Manton Ave,"[41.987222, -87.7682369]","[41.986141, -87.768277]",170311101001,170311101005
2235,2235,[170 -04] 38342,On N Central Ave From W Catalpa Ave To N Lovejoy Ave,2017-2021,N Central Ave And W Catalpa Ave,N Central Ave And N Lovejoy Ave,"[41.98108, -87.76839]","[41.978174, -87.768441]",170311102001,170311102001
2236,2236,[170 -04] 38342,On N Damen Ave From W Howard St To W Jarvis Ave,2017-2021,N Damen Ave And W Howard St,N Damen Ave And W Jarvis Ave,"[42.019473, -87.68047]","[42.0151252, -87.6805309]","[42.019473, -87.68047]",170310102011
2237,2237,[170 -04] 38342,On N Elizabeth St From W Erie St To W Grand Ave,2017-2021,N Elizabeth St And W Erie St,N Elizabeth St And W Grand Ave,"[41.893458, -87.659529]","[41.891087, -87.659461]",170312434002,170312434002
2238,2238,[170 -04] 38342,On N Harlem Ave From W Peterson Ave To W Talcott Ave,2017-2021,N Harlem Ave And W Peterson Ave,N Harlem Ave And W Talcott Ave,"[41.9900141, -87.8068995]","[41.985822, -87.806927]",170311003006,170311003002
2239,2239,[170 -04] 38342,On N Central Ave From N Elston Ave To W Foster Ave,2017-2021,N Central Ave And N Elston Ave,N Central Ave And W Foster Ave,"[41.9850181, -87.7683136]","[41.975686, -87.76848]",170311101005,170311105014
2240,2240,[170 -04] 38342,On N Luna Ave From W Catalpa Ave To W Balmoral Ave,2017-2021,N Luna Ave And W Catalpa Ave,N Luna Ave And W Balmoral Ave,"[41.9811, -87.767144]","[41.9793172, -87.7671828]",170311105012,170311105012
2241,2241,[170 -04] 38342,On N Marmora Ave From W Ardmore Ave To N Milwaukee Ave,2017-2021,N Marmora Ave And W Ardmore Ave,N Marmora Ave And N Milwaukee Ave,"[41.9860375, -87.7745872]","[41.9841799, -87.7755754]",170311101004,170311101003
2242,2242,[170 -04] 38342,On N Nagle Ave From N Avondale Ave To W Bryn Mawr Ave,2017-2021,N Nagle Ave And N Avondale Ave,N Nagle Ave And W Bryn Mawr Ave,"[41.984946, -87.787703]","[41.982858, -87.787742]",170311003001,170311006001
2243,2243,[170 -04] 38342,On N Navarre Ave From N Nashotah Ave To N Napoleon Ave,2017-2021,N Navarre Ave And N Nashotah Ave,N Navarre Ave And N Napoleon Ave,"[41.9888985, -87.7903837]","[41.9878098, -87.7884448]",170311002003,170311002003
2244,2244,[170 -04] 38342,On N Newland Ave From W Hayes Ave To W Imlay St,2017-2021,N Newland Ave And W Hayes Ave,N Newland Ave And W Imlay St,"[41.999991, -87.800469]","[41.9982696, -87.8000935]",170311002006,170311002005
2245,2245,[170 -04] 38342,On N Oakley Blvd From W Kinzie St To W Adams St,2017-2021,N Oakley Blvd And W Kinzie St,N Oakley Blvd And W Adams St,"[41.8886053, -87.6841668]","[41.88322830200195, -87.63240051269531]",170312429002,170318391001
2246,2246,[170 -04] 38342,On N Octavia Ave From W Byron St To W Cornelia Ave,2017-2021,N Octavia Ave And W Byron St,N Octavia Ave And W Cornelia Ave,"[41.95067, -87.80959]","[41.943398, -87.809342]",170311704001,170311708001
2247,2247,[170 -04] 38342,On N Odell Ave From W Byron St To W Belmont Ave,2017-2021,N Odell Ave And W Byron St,N Odell Ave And W Belmont Ave,"[41.9506502, -87.8108634]","[41.93799, -87.810367]",170311704001,"[41.93799, -87.810367]"
2248,2248,[170 -04] 38342,On N Olcott Ave From W Forest Preserve Ave To W Grace St,2017-2021,N Olcott Ave And W Forest Preserve Ave,N Olcott Ave And W Grace St,"[41.950515, -87.814186]","[41.948765, -87.814443]",170311704004,170311704004
2249,2249,[170 -04] 38342,On N Olcott Ave From W Palatine Ave To W Myrtle Ave,2017-2021,N Olcott Ave And W Palatine Ave,N Olcott Ave And W Myrtle Ave,"[41.9954616, -87.8136394]","[41.9935448, -87.8136841]",170311003005,170311003005
2250,2250,[170 -04] 38342,On N Oleander Ave From W Addison St To W Wellington Ave,2017-2021,N Oleander Ave And W Addison St,N Oleander Ave And W Wellington Ave,"[41.945109, -87.815525]","[41.934349, -87.815145]",170311704003,170311709001
2251,2251,[170 -04] 38342,On N Hoyne Ave From W Fulton St To W Maypole Ave,2017-2021,N Hoyne Ave And W Fulton St,N Hoyne Ave And W Maypole Ave,"[41.8867331, -87.6792283]","[41.8840417, -87.6791637]",170318378002,170318378002
2252,2252,[170 -04] 38342,On S Ashland Ave From W 79th St To W 83rd St,2017-2021,S Ashland Ave And W 79th St,S Ashland Ave And W 83rd St,"[41.750346, -87.663386]","[41.743071, -87.663358]",170317106002,170317112001
2253,2253,[170 -04] 38342,On S Archer Ave From S Senour Ave To S Halsted St,2017-2021,S Archer Ave And S Senour Ave,S Archer Ave And S Halsted St,"[41.8452769, -87.6506561]","[41.8472125, -87.6465235]",170318402001,170318402001
2254,2254,[170 -04] 38342,On S Albany Ave From W Cermak Rd To W 26th St,2017-2021,S Albany Ave And W Cermak Rd,S Albany Ave And W 26th St,"[41.851816, -87.702818]","[41.844599, -87.702554]",170318417001,170313009001
2255,2255,[170 -04] 38342,On N Winthrop Ave From W Lawrence Ave To N Kenmore Ave,2017-2021,N Winthrop Ave And W Lawrence Ave,N Winthrop Ave And N Kenmore Ave,"[41.9690412, -87.6576315]","[41.9989283, -87.6578055]",170318307002,170310104003
2256,2256,[170 -04] 38342,On N Ozark Ave From W Addison St To W Cornelia Ave,2017-2021,N Ozark Ave And W Addison St,N Ozark Ave And W Cornelia Ave,"[41.945205, -87.820436]","[41.943189, -87.820358]",170311705001,170311707001
2257,2257,[170 -04] 38342,On N Rutherford Ave From W Foster Ave To W Carmen Ave,2017-2021,N Rutherford Ave And W Foster Ave,N Rutherford Ave And W Carmen Ave,"[41.975552, -87.795162]","[41.9737819, -87.795198]",170311007003,170311007003
2258,2258,[170 -04] 38342,On N Racine Ave From W Grand Ave To W Kinzie St,2017-2021,N Racine Ave And W Grand Ave,N Racine Ave And W Kinzie St,"[41.891096, -87.657403]","[41.8889499, -87.6569745]",170312434002,170312435001
2259,2259,[170 -04] 38342,On N Pioneer Ave From W Berteau Ave To W Irving Park Rd,2017-2021,N Pioneer Ave And W Berteau Ave,N Pioneer Ave And W Irving Park Rd,"[41.9558489, -87.8318321]","[41.9521744, -87.8316532]","[41.9558489, -87.8318321]","[41.9521744, -87.8316532]"
2260,2260,[170 -04] 38342,On N Panama Ave From W Irving Park Rd To W Addison St,2017-2021,N Panama Ave And W Irving Park Rd,N Panama Ave And W Addison St,"[41.9522292, -87.8293724]","[41.944965, -87.82905]","[41.9522292, -87.8293724]",170311705004
2261,2261,[170 -04] 38342,On N Western Ave From W Madison St To W Van Buren St,2017-2021,N Western Ave And W Madison St,N Western Ave And W Van Buren St,"[41.881197, -87.686391]","[41.87689971923828, -87.62310028076172]",170318378001,170313204001
2262,2262,[170 -04] 38342,On S Blackstone Ave From E 83rd St To E 86th St,2017-2021,S Blackstone Ave And E 83rd St,S Blackstone Ave And E 86th St,"[41.744163, -87.588179]","[41.738696, -87.587922]",170318343003,170318343004
2263,2263,[170 -04] 38342,On S Michigan Ave From E 95th St To E 96th St,2017-2021,S Michigan Ave And E 95th St,S Michigan Ave And E 96th St,"[41.721723, -87.620585]","[41.719956, -87.620558]",170314905002,170314905002
2264,2264,[170 -04] 38342,On S Chappel Ave From E 97th Pl To E 98th Pl,2017-2021,S Chappel Ave And E 97th Pl,S Chappel Ave And E 98th Pl,"[41.717994, -87.574054]","[41.717088, -87.574021]",170315103002,170315103004
2265,2265,[170 -04] 38342,On S Constance Ave From E 84th St To E 86th St,2017-2021,S Constance Ave And E 84th St,S Constance Ave And E 86th St,"[41.74247, -87.57946]","[41.738805, -87.579378]",170314503002,170314503003
2266,2266,[170 -04] 38342,On S Dante Ave From E 90th St To E 91st St,2017-2021,S Dante Ave And E 90th St,S Dante Ave And E 91st St,"[41.731378, -87.589234]","[41.7295703, -87.5891713]",170314803001,170314803001
2267,2267,[170 -04] 38342,On S Dr Martin Luther King Jr Dr From E 89th St To E 91st Pl,2017-2021,S Dr Martin Luther King Jr Dr And E 89th St,S Dr Martin Luther King Jr Dr And E 91st Pl,"[41.732843, -87.614447]","[41.728303, -87.614327]",170314406001,170314406002
2268,2268,[170 -04] 38342,On S Ellis Ave From E 65th St To E 67th St,2017-2021,S Ellis Ave And E 65th St,S Ellis Ave And E 67th St,"[41.776833, -87.600386]","[41.773175, -87.600898]",170318344003,170318418002
2269,2269,[170 -04] 38342,On S Hamlin Ave From W 16th St To W 26th St,2017-2021,S Hamlin Ave And W 16th St,S Hamlin Ave And W 26th St,"[41.8589242, -87.7200639]","[41.844322, -87.719659]",170318387001,170313006002
2270,2270,[170 -04] 38342,On S Hermitage Ave From W 69th St To W 70th St,2017-2021,S Hermitage Ave And W 69th St,S Hermitage Ave And W 70th St,"[41.76854, -87.6675756]","[41.766694, -87.6675503]",170316715003,170316715003
2271,2271,[170 -04] 38342,On S Honore St From W 72nd St To W 73rd St,2017-2021,S Honore St And W 72nd St,S Honore St And W 73rd St,"[41.76303, -87.669858]","[41.761209, -87.669822]",170316720002,170316720002
2272,2272,[170 -04] 38342,On S Lawndale Ave From W 18th St To W 19th St,2017-2021,S Lawndale Ave And W 18th St,S Lawndale Ave And W 19th St,"[41.857149, -87.717619]","[41.8550655, -87.7175629]",170312922002,170312922002
2273,2273,[170 -04] 38342,On S Lawndale Ave From W Cermak Rd To W 26th St,2017-2021,S Lawndale Ave And W Cermak Rd,S Lawndale Ave And W 26th St,"[41.851664, -87.7174892]","[41.844361, -87.717233]",170318414002,170313006002
2274,2274,[170 -04] 38342,On S Maplewood Ave From W 66th St To W Marquette Rd,2017-2021,S Maplewood Ave And W 66th St,S Maplewood Ave And W Marquette Rd,"[41.773746, -87.687189]","[41.771925, -87.687118]",170316608002,170316608002
2275,2275,[170 -04] 38342,On N Overhill Ave From W Addison St To W Belmont Ave,2017-2021,N Overhill Ave And W Addison St,N Overhill Ave And W Belmont Ave,"[41.945234, -87.819208]","[41.937906, -87.818935]",170311705001,170311707002
2276,2276,[170 -04] 38342,On S Central Park Ave From W Cermak Rd To W 28th St,2017-2021,S Central Park Ave And W Cermak Rd,S Central Park Ave And W 28th St,"[41.851699, -87.715008]","[41.840727, -87.714694]",170318414002,170313017012
2277,2277,[170 -04] 38342,On N Osceola Ave From W Irving Park Rd To W Forest Preserve Ave,2017-2021,N Osceola Ave And W Irving Park Rd,N Osceola Ave And W Forest Preserve Ave,"[41.952637, -87.813402]","[41.951045, -87.812975]","[41.952637, -87.813402]",170311704004
2278,2278,[170 -04] 38342,On N Hoyne Ave From W Washington Blvd To W Madison St,2017-2021,N Hoyne Ave And W Washington Blvd,N Hoyne Ave And W Madison St,"[41.8831386, -87.6791287]","[41.8813388, -87.6791011]",170318378002,170318378002
2279,2279,[170 -04] 38342,On N Oliphant Ave From W Pratt Ave To N Avondale Ave,2017-2021,N Oliphant Ave And W Pratt Ave,N Oliphant Ave And N Avondale Ave,"[42.0042105, -87.8145861]","[42.001277, -87.817688]",170310902004,170310903001
2280,2280,[170 -04] 38342,On S Normal Ave From W 89th St To W 90th St,2017-2021,S Normal Ave And W 89th St,S Normal Ave And W 90th St,"[41.732607, -87.6362155]","[41.7308486, -87.6361546]",170317115001,170317115001
2281,2281,[170 -04] 38342,On E 73rd St From S Eberhart Ave To S Rhodes Ave,2017-2021,E 73rd St And S Eberhart Ave,E 73rd St And S Rhodes Ave,"[41.762088, -87.612768]","[41.762108, -87.611566]",170316909005,170316909003
2282,2282,[170 -04] 38342,On E 85th Pl From S Stony Island Ave To S Cregier Ave,2017-2021,E 85th Pl And S Stony Island Ave,E 85th Pl And S Cregier Ave,"[41.739642, -87.585723]","[41.73968, -87.580586]",170318343004,170314503003
2283,2283,[170 -04] 38342,On E 89th St From S Kenwood Ave To S Dorchester Ave,2017-2021,E 89th St And S Kenwood Ave,E 89th St And S Dorchester Ave,"[41.7331979, -87.5916949]","[41.7331995, -87.5904824]",170314802002,170314803001
2284,2284,[170 -04] 38342,On E 92nd Pl From S Stony Island Ave To S Cregier Ave,2017-2021,E 92nd Pl And S Stony Island Ave,E 92nd Pl And S Cregier Ave,"[41.726921, -87.585]","[41.726963, -87.580357]",170314804004,170314804004
2285,2285,[170 -04] 38342,On N Ashland Ave From W Fulton St To W Lake St,2017-2021,N Ashland Ave And W Fulton St,N Ashland Ave And W Lake St,"[42.02159225, -87.6706252999991]","[42.022353500002, -87.6707004999833]",170310101001,170310101002
2286,2286,[170 -04] 38342,On N Austin Ave From W Bryn Mawr Ave To N Northwest Hwy,2017-2021,N Austin Ave And W Bryn Mawr Ave,N Austin Ave And N Northwest Hwy,"[41.982871, -87.778047]","[41.980553, -87.778095]",170311102002,170311102002
2287,2287,[170 -04] 38342,On N Central Ave From N Elston Ave To W Catalpa Ave,2017-2021,N Central Ave And N Elston Ave,N Central Ave And W Catalpa Ave,"[41.9850181, -87.7683136]","[41.98108, -87.76839]",170311101005,170311102001
2288,2288,[170 -04] 38342,On N Central Ave From N Indian Rd To W Ardmore Ave,2017-2021,N Central Ave And N Indian Rd,N Central Ave And W Ardmore Ave,"[41.988706, -87.766758]","[41.985834, -87.768284]",170311101001,170311101005
2289,2289,[170 -04] 38342,On N Central Ave From N Northwest Hwy To N Kennedy Expy Ob,2017-2021,N Central Ave And N Northwest Hwy,N Central Ave And N Kennedy Expy Ob,"[41.975197, -87.768486]","[41.9439845, -87.7173535]",170311104001,170318311001
2290,2290,[170 -04] 38342,On N Claremont Ave From W Chase Ave To W Touhy Ave,2017-2021,N Claremont Ave And W Chase Ave,N Claremont Ave And W Touhy Ave,"[42.0140991, -87.6888972]","[42.012302, -87.688914]",170310201001,170310201001
2291,2291,[170 -04] 38342,On N Oriole Ave From W Waveland Ave To W Belmont Ave,2017-2021,N Oriole Ave And W Waveland Ave,N Oriole Ave And W Belmont Ave,"[41.946579, -87.816796]","[41.937955, -87.816498]",170311704003,170311708003
2292,2292,[170 -04] 38342,On N Elizabeth St From W Carroll Ave To W Randolph St,2017-2021,N Elizabeth St And W Carroll Ave,N Elizabeth St And W Randolph St,"[41.88769, -87.658892]","[41.884123, -87.658838]",170318330002,170318330002
2293,2293,[170 -04] 38342,On N Hiawatha Ave From N Loleta Ave To N Central Ave,2017-2021,N Hiawatha Ave And N Loleta Ave,N Hiawatha Ave And N Central Ave,"[42.003764, -87.7712245]","[41.999807, -87.762929]",170311201002,170311202001
2294,2294,[170 -04] 38342,On N Lynch Ave From N Laramie Ave To N Elston Ave,2017-2021,N Lynch Ave And N Laramie Ave,N Lynch Ave And N Elston Ave,"[42.3379184512919, -87.8989879146869]","[41.981074, -87.7612222]","[42.3379184512919, -87.8989879146869]",170311101001
2295,2295,[170 -04] 38342,On N Mason Ave From W Seminole St To W Bryn Mawr Ave,2017-2021,N Mason Ave And W Seminole St,N Mason Ave And W Bryn Mawr Ave,"[41.9847294, -87.7768114]","[41.982863, -87.776842]",170311101003,170311102002
2296,2296,[170 -04] 38342,On N Nashville Ave From W Gregory St To W Balmoral Ave,2017-2021,N Nashville Ave And W Gregory St,N Nashville Ave And W Balmoral Ave,"[41.9820457, -87.7914043]","[41.9792439, -87.7914419]",170311006001,170311006001
2297,2297,[170 -04] 38342,On N Neenah Ave From W Gregory St To W Balmoral Ave,2017-2021,N Neenah Ave And W Gregory St,N Neenah Ave And W Balmoral Ave,"[41.9820531, -87.7901392]","[41.9792577, -87.7902337]",170311006001,170311006001
2298,2298,[170 -04] 38342,On N Normandy Ave From W Devon Ave To W Palatine Ave,2017-2021,N Normandy Ave And W Devon Ave,N Normandy Ave And W Palatine Ave,"[41.9972928, -87.7939388]","[41.9954983, -87.7935787]",170311002002,170311002002
2299,2299,[170 -04] 38342,On N Oconto Ave From W Jarvis Ave To W Chase Ave,2017-2021,N Oconto Ave And W Jarvis Ave,N Oconto Ave And W Chase Ave,"[42.0153042, -87.8078309]","[42.0135198, -87.8078504]",170310901002,170310901002
2300,2300,[170 -04] 38342,On N Octavia Ave From W Roscoe St To W Belmont Ave,2017-2021,N Octavia Ave And W Roscoe St,N Octavia Ave And W Belmont Ave,"[41.9415111, -87.8092438]","[41.937988, -87.809156]",170311708001,170311709001
2301,2301,[170 -04] 38342,On N Oketo Ave From W Addison St To W School St,2017-2021,N Oketo Ave And W Addison St,N Oketo Ave And W School St,"[41.945175, -87.811794]","[41.9397339, -87.8114265]",170311704002,170311708002
2302,2302,[170 -04] 38342,On N Olcott Ave From W Ibsen St To W Pratt Ave,2017-2021,N Olcott Ave And W Ibsen St,N Olcott Ave And W Pratt Ave,"[42.0061, -87.8136983]","[42.0042444, -87.8137252]",170310902005,170310902005
2303,2303,[170 -04] 38342,On N Olcott Ave From W Waveland Ave To W Cornelia Ave,2017-2021,N Olcott Ave And W Waveland Ave,N Olcott Ave And W Cornelia Ave,"[41.946643, -87.814355]","[41.943301, -87.814233]",170311704003,170311708002
2304,2304,[170 -04] 38342,On N Elizabeth St From W Grand Ave To W Kinzie St,2017-2021,N Elizabeth St And W Grand Ave,N Elizabeth St And W Kinzie St,"[41.891087, -87.659461]","[41.88892, -87.658938]",170312434002,170318330002
2305,2305,[170 -04] 38342,On S Prairie Ave From E 79th St To E 80th St,2017-2021,S Prairie Ave And E 79th St,S Prairie Ave And E 80th St,"[41.751061, -87.618157]","[41.749243, -87.618114]",170314403004,170314403004
2306,2306,[170 -04] 38342,On S Prairie Ave From E 93rd St To E 95th St,2017-2021,S Prairie Ave And E 93rd St,S Prairie Ave And E 95th St,"[41.725478, -87.617821]","[41.721827, -87.617781]",170314903001,170314905002
2307,2307,[170 -04] 38342,On W Forest Preserve Ave From N Pontiac Ave To N Panama Ave,2017-2021,W Forest Preserve Ave And N Pontiac Ave,W Forest Preserve Ave And N Panama Ave,"[41.940766, -87.834903]","[41.943465, -87.828968]",170311706002,170311706001
2308,2308,[170 -04] 38342,On W Grenshaw St From S Western Ave To S Oakley Blvd,2017-2021,W Grenshaw St And S Western Ave,W Grenshaw St And S Oakley Blvd,"[41.8675271, -87.6861422]","[41.8675621, -87.6836236]",170312827001,170312828001
2309,2309,[170 -04] 38342,On W Loyola Ave From N Winchester Ave To N Ridge Blvd,2017-2021,W Loyola Ave And N Winchester Ave,W Loyola Ave And N Ridge Blvd,"[42.0003289, -87.6790748]","[42.0003708, -87.6779429]",170310205001,170318306004
2310,2310,[170 -04] 38342,On W Morse Ave From N Western Ave To N Bell Ave,2017-2021,W Morse Ave And N Western Ave,W Morse Ave And N Bell Ave,"[42.0068341, -87.6900733]","[42.007279, -87.686021]",170310204003,170310204002
2311,2311,[170 -04] 38342,On W North Ave From N Harlem Ave To N Sayre Ave,2017-2021,W North Ave And N Harlem Ave,W North Ave And N Sayre Ave,"[41.9088, -87.805665]","[41.909025, -87.800203]","[41.9088, -87.805665]",170312505003
2312,2312,[170 -04] 38342,On W Ogden Ave From S Albany Ave To S Farrar Dr,2017-2021,W Ogden Ave And S Albany Ave,W Ogden Ave And S Farrar Dr,"[41.858617, -87.702908]","[41.86114955, -87.69681535000001]",170318431002,170318431001
2313,2313,[170 -04] 38342,On W Ogden Ave From S Drake Ave To S Trumbull Ave,2017-2021,W Ogden Ave And S Drake Ave,W Ogden Ave And S Trumbull Ave,"[41.854835, -87.713715]","[41.855779, -87.711346]",170318414001,170318414001
2314,2314,[170 -04] 38342,On W Ogden Ave From S Homan Ave To S Albany Ave,2017-2021,W Ogden Ave And S Homan Ave,W Ogden Ave And S Albany Ave,"[41.856286, -87.710261]","[41.858617, -87.702908]",170312922001,170318431002
2315,2315,[170 -04] 38342,On W Ogden Ave From S Millard Ave To S Albany Ave,2017-2021,W Ogden Ave And S Millard Ave,W Ogden Ave And S Albany Ave,"[41.8542447, -87.7160166]","[41.858617, -87.702908]",170318414002,170318431002
2316,2316,[170 -04] 38342,On W Ogden Ave From S Springfield Ave To S Ridgeway Ave,2017-2021,W Ogden Ave And S Springfield Ave,W Ogden Ave And S Ridgeway Ave,"[41.851906, -87.722277]","[41.853278, -87.718721]",170312924002,170318414002
2317,2317,[170 -04] 38342,On W Pershing Rd From S Damen Ave To S Paulina St,2017-2021,W Pershing Rd And S Damen Ave,W Pershing Rd And S Paulina St,"[41.8230799, -87.6768773]","[41.8232244, -87.6677811]",170316103003,170315907001
2318,2318,[170 -04] 38342,On W Forest Preserve Ave From N Olcott Ave To W Irving Park Rd,2017-2021,W Forest Preserve Ave And N Olcott Ave,W Forest Preserve Ave And W Irving Park Rd,"[41.950161, -87.814917]","[41.95273, -87.809453]",170311704004,"[41.95273, -87.809453]"
2319,2319,[170 -04] 38342,On W Roosevelt Rd From S Albany Ave To S Whipple St,2017-2021,W Roosevelt Rd And S Albany Ave,W Roosevelt Rd And S Whipple St,"[41.866461, -87.703196]","[41.866471, -87.702013]",170318386001,170318386001
2320,2320,[170 -04] 38342,On W Schreiber Ave From N Oak Park Ave To N Natoma Ave,2017-2021,W Schreiber Ave And N Oak Park Ave,W Schreiber Ave And N Natoma Ave,"[41.998164, -87.795598]","[41.9981976, -87.7923156]",170311002007,170311002001
2321,2321,[170 -04] 38342,On W Taylor St From S Marshfield Ave To S Loomis St,2017-2021,W Taylor St And S Marshfield Ave,W Taylor St And S Loomis St,"[41.869265, -87.667705]","[41.869337, -87.661631]",170318382002,170312832001
2322,2322,[170 -04] 38342,On W Warren Blvd From N Kedzie Ave To N Sacramento Blvd,2017-2021,W Warren Blvd And N Kedzie Ave,W Warren Blvd And N Sacramento Blvd,"[41.881911, -87.706168]","[41.8819729, -87.701246]",170318369002,170318369001
2323,2323,[170 -04] 38342,On W Washington Blvd From N Talman Ave To N Leavitt St,2017-2021,W Washington Blvd And N Talman Ave,W Washington Blvd And N Leavitt St,"[41.882967, -87.69225]","[41.8830685, -87.6816033]",170318371002,170318378001
2324,2324,[170 -04] 38342,830-888 E 88th St,2017-2021,830 E 88th St,888 E 88th St,"[41.735077, -87.603399]","[41.73491298698177, -87.60188011796464]",170314408001,170314408001
2325,2325,[170 -04] 38342,1200-1210 N Dearborn St,2017-2021,1200 N Dearborn St,1210 N Dearborn St,"[41.904152, -87.630411]","[41.904351, -87.630121]",170310802023,170310802023
2326,2326,[170 -04] 38342,855-881 N La Salle Dr,2017-2021,855 N La Salle Dr,881 N La Salle Dr,"[41.898322, -87.632526]","[41.89898, -87.632332]",170310810002,170310810002
2327,2327,[170 -04] 38342,3000-3140 N Octavia Ave,2017-2021,3000 N Octavia Ave,3140 N Octavia Ave,"[41.934595, -87.809436]","[41.9375218, -87.8094812]",170311709001,170311709001
2328,2328,[170 -04] 38342,7216-7300 N Odell Ave,2017-2021,7216 N Odell Ave,7300 N Odell Ave,"[42.012135, -87.810535]","[42.013675, -87.810621]",170310901002,170310901002
2329,2329,[170 -04] 38342,3912-3970 N Olcott Ave,2017-2021,3912 N Olcott Ave,3970 N Olcott Ave,"[41.950878, -87.814972]","[41.95232539314217, -87.8146615539565]",170311704004,170311704004
