location_name,blockgroup_id
S Paulina St And W 88th St,'170317113001'
S Lawndale Ave And W 32nd St,'170318305003'
S Aberdeen St And W 107th St,'170317501002'
N Cicero Ave And W Lawrence Ave,'170311601002'
S Avenue J And E 99th St,'170315201001'
N Mayfield Ave And W Madison St,'170312521011'
N Keating Ave And W Devon Ave,'170311203006'
N Mcvicker Ave And W Ardmore Ave,'170311001003'
N Menard Ave And W Madison St,'170312520002'
N Mozart St And W Argyle St,'170310403003'
S Austin Blvd And W Roosevelt Rd,'170318314002'
S Mason Ave And W Arthington St,'170318314002'
S Mayfield Ave And W Roosevelt Rd,'170318314002'
S Monitor Ave And W Roosevelt Rd,'170318314002'
S Scottsdale Ave And S Knox Ave,'170317003013'
S St Louis Ave And W Columbus Ave,'170317004011'
W 60th Pl And S Wells St,'170318346003'
N Moody Ave And W Ardmore Ave,'170311001003'
N Normandy Ave And W Devon Ave,'170311002002'
S Keeler Ave And W 78th St,'170317002004'
S May St And W 107th St,'170317501002'
S Menard Ave And W Roosevelt Rd,'170318314002'
S Princeton Ave And W 60th Pl,'170318346003'
S Springfield Ave And W 78th St,'170317002003'
S Whipple St And W 52nd St,'170316304004'
W 77th Pl And S Keeler Ave,'170317002004'
W Madison St And N Menard Ave,'170312520002'
W 79th St And S Karlov Ave,'170317002004'
W 77th St And S Emerald Ave,'170317101001'
W 66th St And S Pulaski Rd,'170316503022'
W 59th St And S Nashville Ave,'170316404001'
W 58th Pl And S Hamlin Ave,'170316204002'
W 52nd St And S Francisco Ave,'170316304001'
W 104th St And S Hoyne Ave,'170317206001'
S Perry Ave And W 68th St,'170316903001'
S Lafayette Ave And W 115th St,'170315302001'
S Karlov Ave And W 79th St,'170317002004'
S Carpenter St And W 64th St,'170316810004'
N Washtenaw Ave And W Argyle St,'170310402014'
N Elston Ave And W Augusta Blvd,'170318423001'
E 43rd St And S Vernon Ave,'170313802002'
W Palmer St And N Cicero Ave,'170311911001'
W Ardmore Ave And N Austin Ave,'170311001003'
W 77th St And S Perry Ave,'170316912002'
W 73rd St And S Kedzie Ave,'170316611003'
W 65th St And S Lawndale Ave,'170316503022'
W 58th St And S Halsted St,'170318347001'
W 52nd St And S Kedzie Ave,'170316303001'
W 107th St And S Morgan St,'170317501002'
W Palatine Ave And N Natoma Ave,'170311002002'
S Perry Ave And W Marquette Rd,'170316903001'
S Kostner Ave And W 81st Pl,'170317003013'
S Emerald Ave And W 79th St,'170317109001'
S Ashland Ave And W 108th Pl,'170317502001'
N Sheffield Ave And W Wellington Ave,'170310630003'
N Drake Ave And W Foster Ave,'170318318004'
S Morgan St And W 107th St,'170317501002'
W Polk St And S Pulaski Rd,'170312609002'
W Montrose Ave And N Mulligan Ave,'170311505021'
W Montrose Ave And N Mobile Ave,'170311505021'
W Newport Ave And N Narragansett Ave,'170311711003'
N Oriole Ave And W Birchwood Ave,'170310901004'
S Aberdeen St And W 103rd St,'170317307002'
S Calumet Ave And E 89th St,'170314406001'
E 102nd St And S State St,'170314907002'
N Pulaski Rd And W Augusta Blvd,'170318421006'
S Oglesby Ave And E 99th St,'170315103004'
S Seeley Ave And W 101st Pl,'170317203003'
S Damen Ave And W 100th St,'170317203001'
E 95th St And S Cottage Grove Ave,'170314701001'
W Bryn Mawr Ave And N Campbell Ave,'170310208011'
N Rockwell St And W Catalpa Ave,'170310402021'
W Hollywood Ave And N Rockwell St,'170310208011'
N Kenmore Ave And W Diversey Pkwy,'170310629002'
W Lawrence Ave And N Cicero Ave,'170311601002'
N Kenton Ave And W Fullerton Ave,'170312002003'
S Oakley Ave And W 91st St,'170317201002'
N Kentucky Ave And N Kilbourn Ave,'170311404004'
N Oketo Ave And W School St,'170311708002'
N Spaulding Ave And N Elston Ave,'170311608002'
S Christiana Ave And W 54th St,'170316303002'
S Drake Ave And W Cermak Rd,'170318414002'
S Lafayette Ave And W 122nd St,'170315305014'
S Perry Ave And W 122nd St,'170315305014'
W Cullom Ave And N Campbell Ave,'170310503003'
W Pensacola Ave And N Campbell Ave,'170310503001'
W Ainslie St And N Menard Ave,'170311104002'
E 84th St And S Bennett Ave,'170314503002'
N Natoma Ave And W Argyle St,'170311007002'
N Rutherford Ave And W Argyle St,'170311007003'
S Bell Ave And W 91st St,'170317201002'
S Claremont Ave And W 91st St,'170317201002'
S Eggleston Ave And W 105th St,'170314911001'
W 106th St And S Sacramento Ave,'170317401002'
W Maypole Ave And N Hamlin Blvd,'170318368001'
W Washington Blvd And N Pulaski Rd,'170312601001'
W Berwyn Ave And N Paulina St,'170310309003'
E 95th St And S Torrence Ave,'170315102001'
W Peterson Ave And N Kilbourn Ave,'170311203005'
S Seeley Ave And W 101st St,'170317203001'
N Lavergne Ave And W Cornelia Ave,'170311510011'
E 92nd St And S St Lawrence Ave,'170314409002'
N Seeley Ave And W Birchwood Ave,'170310102012'
E 101st St And S Ewing Ave,'170315202002'
S Halsted St And W 128th Pl,'170315305031'
W 85th St And S Lawndale Ave,'170317004022'
Ashe Cps - 8505 S Ingleside Ave,'170314401021'
Cook Cps - 8150 S Bishop St,'170317106001'
Davis N Cps - 3014 W 39th Pl,'170315805011'
Field Cps - 7019 N Ashland Blvd,'170310106004'
Gunsaulus Cps - 4420 S Sacramento Ave,'170315805022'
Leland Cps - 5221 W Congress Pkwy,'170312521023'
Morton Cps - 431 N Troy St,'170318367002'
Orozco Cps - 1940 W 18th St,'170313109001'
Wadsworth Cps - 6420 S University Ave,'170318344001'
Westcott Cps - 409 W 80th St,'170318424003'
Cather Cps - 2908 W Washington Blvd,'170318371002'
Corkery Cps - 2510 S Kildare Ave,'170313018012'
Fernwood Cps - 10041 S Union Ave,'170317305003'
Grissom Cps - 12810 S Escanaba Ave,'170315502001'
Heroes Cps - 8344 S Commercial Ave,'170314603023'
Morrill Cps - 6011 S Rockwell St,'170318350005'
Nash Cps - 4837 W Erie St,'170312517001'
Schmid Cps - 9755 S Greenwood Ave,'170315001002'
Webster Cps - 4055 W Arthington St,'170312610002'
E 71st St And S Jeffery Blvd,'170314305001'
N Ottawa Ave And W Waveland Ave,'170311704003'
N Lake Shore Dr Sb And W Wilson Dr,'170310314006'
W Leland Ave And N Clark St,'170310318001'
S Hermitage Ave And W 58th St,'170316703002'
10100 S Seeley Ave,'170317203003'
W 76th St And S Halsted St,'170317102001'
W 78th St And S Emerald Ave,'170317101001'
W Altgeld St And N Keeler Ave,'170312002002'
W 60th St And S Hamlin Ave,'170316501004'
W 52nd St And S Kostner Ave,'170315705001'
S Halsted St And W 77th St,'170317101001'
W Cullom Ave And N Ravenswood Ave,'170310602001'
N Maplewood Ave And W North Shore Ave,'170310206024'
N Hamlin Ave And W Addison St,'170311609002'
E 90th St And S Constance Ave,'170314804007'
N Rockwell St And W Foster Ave,'170310402012'
W Belle Plaine Ave And N Albany Ave,'170311606022'
E 118th St And S Prairie Ave,'170315301001'
N Fairfield Ave And W Albion Ave,'170310206011'
N Keystone Ave And W Glenlake Ave,'170311302001'
N Nordica Ave And W Berwyn Ave,'170311006003'
S Genoa Ave And W 98th St,'170317304003'
S Parnell Ave And W 129th Pl,'170315305033'
W 57th St And S Kedzie Ave,'170316308002'
W 70th St And S Ashland Ave,'170316716002'
W Hunt Ave And S Longwood Dr,'170317201002'
W 116th St And S Western Ave,'170317504002'
S Marshfield Ave And W 88th St,'170317113001'
N Merrimac Ave And W Dickens Ave,'170311913012'
S Hermitage Ave And W 88th St,'170317113002'
W North Shore Ave And N Maplewood Ave,'170310206024'
N Seminary Ave And W Diversey Pkwy,'170310629002'
N Harlem Ave And W Talcott Ave,'170311003002'
N Central Ave And W Montrose Ave,'170311503006'
S Yale Ave And W 76th St,'170316912002'
S Wood St And W 88th St,'170317113001'
S Winchester Ave And W 88th St,'170317113002'
N Iron And W 39th Pl,'170315907002'
S Iron St And W Pershing Rd,'170315907002'
5548 S Kostner Ave,'170316203004'
E 111th St And S Indiana Ave,'170314914003'
N Oleander Ave And W Grace St,'170311704004'
S Emerald Ave And W 106th St,'170314911005'
W Forest Preserve Ave And N Ottawa Ave,'170311704004'
N Natchez Ave And W Catalpa Ave,'170311006001'
S Albany Ave And W 21st Pl,'170318417001'
S Harvard Ave And W 81st St,'170318424002'
W Chestnut St And N Orleans St,'170310818002'
S La Salle St And W 105th St,'170314910004'
6500 S Normal Blvd,'170316809001'
W Olive Ave And N Ozanam Ave,'170311005004'
W Gladys Ave And S Hoyne Ave,'170318380002'
S Menard Ave And W Adams Blvd,'170312521011'
S Damen Ave And W Pershing Rd,'170316103003'
244 N Post Pl,'170318391001'
W Higgins Ave And N Overhill Ave,'170311005004'
S Waller Ave And W Adams Blvd,'170312521011'
S East End Ave And E 79th St,'170318342003'
7514 S Yale Ave,'170316912002'
S Essex Ave And S South Chicago Ave,'170314606001'
E 87th St And S Colfax Ave,'170314606001'
E 130th St And S Torrence Ave,'170315502002'
E 109th St And S Indiana Ave,'170314909013'
S Hermosa Ave And S Homewood Ave,'170317505003'
S Perry Ave And W 116th St,'170315302001'
W 104th St And S Wood St,'170317207003'
W 87th St And S Union Ave,'170317109002'
S Elizabeth St And W 122nd St,'170315304002'
S Throop St And W 122nd St,'170315304002'
S Western Ave And W 66th St,'170316608001'
S Harding Ave And W 24th St,'170313005001'
S Perry Ave And W 105th St,'170314910004'
W Berteau Ave And N Lawndale Ave,'170311604001'
E 109th St And S Dr Martin Luther King Jr Dr,'170314909013'
S Ashland Ave And W 66th St,'170316712001'
S Ridgeland Ave And E 79th St,'170318342003'
W 116th St And S Wentworth Ave,'170315302005'
W 66th St And S Justine St,'170316711001'
W 91st St And S Perry Ave,'170318340001'
W Sunnyside Ave And N Lavergne Ave,'170311502004'
W 81st St And S May St,'170317108006'
W 117th St And S Normal Ave,'170315302005'
W 100th St And S Wood St,'170317202003'
S Halsted St And W 76th St,'170317102001'
N Hamlin Ave And W Devon Ave,'170311301001'
N Laporte Ave And W Sunnyside Ave,'170311502004'
W 65th St And S Fairfield Ave,'170316606003'
W 81st St And S Racine Ave,'170317107003'
E 54th Pl And S Dorchester Ave,'170314108002'
E 54th St And S Dorchester Ave,'170314108001'
W Bryn Mawr Ave And N Jersey Ave,'170318318005'
S Emerald Ave And W 78th St,'170317101001'
S Carpenter St And W 32nd Pl,'170318397003'
S Aberdeen St And W 35th St,'170318397001'
W 35th St And S Racine Ave,'170318397001'
E 106th St And S Rhodes Ave,'170314909021'
W 45th St And S Cicero Ave,'170315601001'
